ID;Feature;PoS;Function;Level;Turkish;Bashkir;BeryozovkaEven;Bonan;Tsuken;Chagatai;Chuvash;CrimeanTatar;Dagur;Dolgan;Dongxiang;ShiraYughur;Gagauz;Khalkha;Hateruma;Solon;Mongghul;Ikema;KaraKalpak;Kazakh;Khakas;KhamnigalMongol;Korean;Manchu;MiddleMongol;MiddleKorean;Mangghuer;Moghol;MomaEven;Nanai;Negidal;Nogai;NorthernUzbek;Azerbaijani;Ura;Japanese;Ogami;Oirat;Okinoerabu;EasternOldJapanese;OldTurkic;Ordos;Oroch;Orok;Buriat;Shor;Shuri;Evenki;Yuwan;Tarama;Tatar;Kalmyk;Khalaj;Turkmen;Tuvan;Udihe;Uighur;Ulch;Yakut;Yonaguni
TE040;Are causative posture verbs derived and static-dynamic verbs basic?;verb;NA;NA;0;?;?;?;?;?;1;?;?;1;?;?;?;?;?;?;1;?;?;?;?;?;?;?;?;?;1;?;?;1;?;?;?;?;?;1;?;?;?;?;?;?;?;?;?;1;?;?;?;?;?;?;?;?;?;?;?;?;?;?
TE041;Is there a male/female distinction in the sibling terms from the perspective of the speaker?;NA;NA;NA;1;?;?;?;?;?;?;?;?;?;?;?;?;?;?;?;?;?;?;?;?;?;1;?;?;?;?;?;?;1;?;?;?;?;?;0;?;?;?;?;?;?;?;?;?;1;?;?;?;?;?;?;?;?;?;?;?;?;?;?
TE042;Is there an age distinction in sibling terms?;NA;NA;NA;1;?;?;?;?;?;?;?;?;?;?;?;?;?;?;?;?;?;?;?;?;?;1;?;?;?;?;?;?;?;?;?;?;0;?;1;1;?;?;?;?;?;?;?;?;1;?;?;?;?;?;?;?;?;?;?;?;?;?;?
TE043;Are nouns most commonly derived from verbs than the other way around?;NA;NA;NA;1;?;?;?;?;?;?;?;?;?;?;?;?;?;?;?;?;?;?;?;?;?;1;?;?;?;0;?;?;?;1;?;?;?;?;1;0;?;?;?;0;?;?;?;?;?;?;0;?;?;1;?;1;?;?;0;?;1;?;?
TE044;Are hand and arm expressed by the same term?;NA;NA;NA;0;?;?;?;?;?;1;?;?;?;?;?;?;1;?;1;?;?;?;?;?;?;0;1;?;?;1;0;?;?;?;?;?;1;?;0;?;?;?;?;?;?;?;?;0;1;?;0;?;?;1;1;?;?;?;1;?;?;?;?
TE045;Are moon and month expressed by the same term?;NA;NA;NA;1;?;?;?;?;?;1;?;?;?;?;?;?;?;?;?;?;?;?;?;?;?;1;?;?;?;?;?;?;?;?;?;?;1;?;0;?;?;?;?;?;?;?;?;?;1;?;?;?;?;?;?;?;?;?;?;?;?;?;?
TE046;Is there a plural/collective suffix that is restricted to animates?;noun;number;NA;0;0;0;0;?;0;0;0;1;0;0;0;0;1;1;0;0;?;0;0;0;1;0;1;0;1;0;0;0;1;1;0;0;0;1;1;1;1;1;0;0;1;1;1;1;0;1;0;1;?;0;?;0;0;0;1;0;0;1;0
TE047;Can scalar additive operators (even) also be used in non-scalar contexts (also)?;NA;NA;NA;0;?;?;?;?;?;?;?;?;?;?;?;?;?;?;?;?;?;?;?;?;?;1;?;0;1;1;?;?;?;?;?;?;0;?;1;?;?;?;0;?;?;?;?;?;1;1;?;?;?;0;?;?;?;?;?;?;?;?;?
TE048;Is there a reflexive-possessive affix?;NA;possession;NA;0;?;?;?;?;?;?;?;?;?;?;?;0;?;0;?;?;?;?;?;?;?;0;?;?;?;0;?;?;1;1;?;?;?;?;0;?;?;?;?;?;?;?;?;?;?;?;1;?;?;?;?;?;?;?;1;?;?;?;0
TE049;Are demonstratives verbally encoded?;demonstrative;deixis;NA;0;0;0;?;?;?;0;0;0;?;0;0;0;?;0;0;0;?;0;?;0;0;0;0;?;?;?;0;0;1;0;?;?;0;?;0;0;0;?;0;0;0;0;0;?;0;0;0;?;?;0;?;0;?;?;0;?;0;0;0
TE050;Do cardinal numerals require agreement on noun phrases?;noun;number;NP;0;0;0;0;0;0;0;0;0;0;0;0;0;0;1;0;0;0;0;0;0;0;0;0;0;0;0;0;1;0;0;?;0;0;?;0;0;0;0;0;0;0;0;0;0;0;?;0;0;?;0;0;0;0;0;0;0;?;0;?
TE051;Is nominative case unmarked?;noun;argument marking (core);word;1;1;1;1;0;1;1;1;1;1;0;1;1;1;1;1;1;0;1;1;1;1;1;1;1;0;1;1;0;1;1;1;1;1;0;1;0;1;0;1;1;1;1;1;1;1;0;1;0;0;1;1;1;1;1;1;1;1;0;0
TE052;Are accusative-marked objects specific while unmarked objects are non-specific?;multiple;argument marking (core);word;1;1;0;1;0;?;1;1;1;1;1;1;1;1;0;0;1;0;1;1;?;1;0;1;0;0;1;0;0;0;0;?;?;1;0;0;0;1;0;0;?;1;0;0;1;1;0;0;0;0;1;1;1;1;1;1;1;0;1;0
TE053;Are recipient and location expressed by the same marker?;multiple;argument marking (non-core);word;0;0;1;1;0;0;1;0;1;1;1;1;0;1;0;1;1;?;0;0;0;1;1;1;1;1;1;1;?;1;0;0;0;0;?;1;1;1;0;1;1;1;1;1;1;1;1;0;0;1;0;1;1;0;0;1;0;0;1;1
TE054;Is there a distinction between marking of interrogation in polar and content questions?;multiple;interrogation;clause;1;1;1;1;?;?;1;1;1;1;?;?;1;1;1;1;?;1;1;?;1;1;0;0;?;1;1;?;?;1;1;?;1;1;1;0;?;?;1;1;1;1;?;1;1;1;1;1;1;1;1;0;?;1;?;0;?;1;1;1
TE055;Is acting agent in passive clause expressed by a dative-marked noun phrase?;multiple;valency;clause;0;0;1;0;1;?;0;0;1;1;0;?;?;1;1;1;0;1;?;1;1;?;1;1;?;?;0;?;?;1;1;?;0;0;1;1;1;1;1;1;1;1;1;1;1;0;1;1;1;?;?;1;?;1;0;1;0;?;1;0
TE056;Is the subject of an adnominalized clause marked by the genitive case?;multiple;argument marking (core);clause;1;?;?;?;?;?;?;1;?;?;?;?;?;?;?;?;?;?;?;?;?;1;?;0;1;?;?;?;?;1;?;?;?;?;?;0;?;?;?;?;?;?;?;1;?;0;?;?;?;?;1;?;?;?;?;1;?;?;?;?
TE057;Can a passive construction have adversative meaning?;NA;valency;NA;0;?;0;?;?;?;0;?;?;0;?;0;?;?;?;?;0;?;?;?;?;?;1;?;?;?;0;?;?;0;?;?;?;?;?;1;1;?;?;?;?;?;?;?;?;0;?;1;1;?;?;?;0;?;?;0;?;?;0;1
TE058;Can demonstrative/interrogative verbs be derived from pronouns and light verbs to do?;verb;other;NA;0;?;0;?;?;?;0;0;?;?;?;1;0;?;?;?;?;?;?;0;0;?;0;?;?;?;?;?;0;?;?;?;?;0;?;0;0;1;0;?;?;?;0;0;?;?;?;?;?;?;0;?;?;?;?;?;?;?;?;0
TE059;Are causative and passive expressed by a formally identical marker?;verb;valency;word;0;0;0;0;0;?;0;0;0;1;0;0;0;0;0;0;0;0;0;?;0;?;1;1;?;1;0;0;0;0;0;?;0;0;0;0;0;0;0;?;?;0;0;1;0;0;0;1;0;0;0;0;0;0;1;0;?;0;0;0
TE060;Are converb suffixes and deverbal noun suffixes formally identical?;multiple;NA;word;?;1;?;?;?;?;1;?;?;?;?;?;?;?;?;?;?;?;?;?;?;?;?;?;?;?;?;?;?;?;?;?;?;?;?;?;?;?;?;?;?;?;?;?;?;?;?;?;?;?;?;?;?;?;?;?;?;?;?;?
TE061;Are quotative markers adverbial derivations from a verb to say?;verb;NA;NA;1;?;?;?;?;?;?;?;?;?;?;?;?;1;?;1;?;?;1;?;1;?;1;1;?;?;?;?;?;0;?;?;?;?;?;0;?;?;0;?;?;?;?;?;?;1;?;?;?;?;?;?;?;1;?;1;?;?;?;?
TE062;Can relational adpositions (e.g. under) be derived from a place noun (e.g. bottom) and a locational suffix (e.g. at LOC)?;other;argument marking (non-core);word;1;?;?;?;?;1;1;1;?;?;?;1;1;1;?;1;1;?;1;1;1;?;?;1;?;0;?;?;?;1;1;?;1;?;?;0;?;?;0;?;?;?;1;1;1;?;?;1;?;?;0;1;1;1;?;1;?;1;1;0
TE063;Are hortatives/purposives encoded by the same marker (eventually involving a converb of the verb to say)?;verb;NA;NA;0;?;?;?;?;?;1;?;?;?;?;?;?;?;0;?;?;?;?;?;?;?;?;?;?;?;?;?;?;0;?;?;?;?;?;1;0;?;?;?;?;?;0;?;?;1;?;?;?;?;?;?;0;?;?;0;?;0;?;?
TE064;Are denominal verbalizers and deverbal suffixes sharing comparable actional semantics expressed by the same marker?;verb;NA;NA;?;?;?;?;?;?;?;?;?;?;?;?;?;?;?;?;?;?;?;?;?;?;?;?;?;?;?;?;?;1;?;?;?;?;?;?;?;?;?;?;?;?;?;?;?;?;?;?;?;?;?;?;?;?;?;?;?;?;?;?
TE065;Is it is becoming if grammaticalized in deontic modality?;verb;NA;NA;0;?;1;?;?;?;?;?;?;?;?;?;?;?;?;?;?;?;?;?;?;?;1;?;?;?;?;?;?;?;?;?;?;0;?;1;?;?;?;?;?;?;0;?;1;0;?;?;?;?;?;?;0;?;?;0;?;?;0;1
TE066;Is imperative form for 2SG identical to bare verb root?;verb;TAME;word;1;1;0;1;0;1;1;1;1;1;1;1;1;1;0;0;1;0;1;1;1;1;0;1;1;0;1;1;0;0;0;1;1;1;0;0;0;1;0;0;1;1;0;0;1;1;0;0;0;0;1;1;1;1;1;0;1;0;1;0
TE067;Is person marking on the verb formally identical to independent personal pronouns?;verb;NA;NA;0;?;?;?;?;?;0;?;0;?;?;?;0;0;0;?;0;0;?;?;?;?;0;?;?;0;0;1;?;0;?;?;1;?;?;0;0;?;0;?;?;0;1;1;?;?;?;?;0;0;?;?;?;0;1;0;1;1;?;0
TE068;Is there a comparative construction that employs a marker of the standard which elsewhere has a meaning to see?;verb;NA;clause;0;?;0;?;?;?;0;0;0;?;0;0;0;0;?;0;0;?;0;0;0;?;1;?;?;0;0;0;0;0;0;0;0;0;?;0;?;0;0;?;0;0;0;0;?;0;?;0;?;?;0;?;0;0;0;0;0;0;?;0
TE069;Can a copula be derived from original posture verbs?;NA;NA;NA;0;?;?;?;?;?;?;?;?;?;?;?;?;?;?;?;?;?;?;?;?;?;?;?;?;?;?;?;?;?;?;?;?;?;?;0;?;?;0;?;?;?;?;?;?;?;?;?;?;?;?;?;?;?;?;?;?;?;?;?
TE070;Can the notional subject of a want complement clause be expressed overtly when it is coreferential with the wanter?;NA;NA;NA;0;?;?;?;?;?;?;?;?;?;?;?;?;?;?;?;?;?;?;?;?;?;0;?;?;?;?;?;?;0;?;?;?;?;?;0;?;?;?;?;?;?;?;?;?;?;?;?;?;?;?;?;?;?;?;?;?;?;?;?
TE071;Are foot and leg expressed by the same term?;noun;NA;NA;0;?;?;?;?;?;?;?;?;?;?;?;?;?;?;?;?;?;?;?;?;?;0;?;?;?;?;?;?;?;?;?;?;1;?;1;?;?;?;?;?;?;?;?;?;?;?;?;?;?;?;?;?;?;?;?;?;?;?;?
TE072;Are there balanced purpose clauses?;NA;NA;NA;?;?;?;?;?;?;?;?;?;?;?;?;?;?;?;?;?;?;?;?;?;?;?;?;?;?;?;?;?;?;?;?;?;?;?;0;?;?;?;?;?;?;?;?;?;?;?;?;?;?;?;?;?;?;?;?;?;?;?;?
TE073;Is there an adposition or a particle formally similar to the verb?;other;NA;NA;?;?;0;?;?;?;?;0;?;?;?;?;0;?;0;0;?;0;?;?;1;?;1;?;?;1;?;?;?;?;?;?;?;?;?;0;?;?;0;?;?;?;0;0;?;?;?;?;?;?;0;?;0;?;?;0;?;?;?;0
TE074;Is completive aspect expressed by a marker formally identical to the verb to put/throw away?;verb;TAME;clause;0;?;0;?;0;?;?;0;1;0;?;?;0;?;?;?;?;?;1;?;?;?;1;?;?;?;?;0;0;?;?;?;?;?;?;1;?;?;?;?;?;?;0;?;1;0;?;?;?;0;0;1;0;?;?;0;?;?;?;0
TE076;Are there adpositions to mark core NPs?;other;argument marking (core);NP;0;?;0;?;1;0;?;0;0;?;0;0;0;?;0;0;0;1;0;0;0;0;1;?;?;1;?;0;0;?;0;?;0;0;?;1;?;0;1;1;?;0;0;0;?;0;1;0;?;1;0;?;0;0;?;0;?;0;0;1
TE077;Are there adpositions to mark oblique NPs?;other;argument marking (non-core);NP;1;?;1;?;1;1;?;1;1;?;1;1;1;?;1;1;1;1;1;1;1;1;1;1;?;1;?;1;1;0;1;?;1;1;?;1;?;1;1;1;?;1;1;1;?;1;1;1;?;1;1;?;1;1;?;1;?;1;1;1
TE078;Are there three laryngeal contrasts for stops?;not assignable;phonological distinctiveness;phonological shape;0;?;0;0;0;?;0;0;0;0;0;0;0;0;0;0;0;0;0;0;0;0;1;0;0;1;0;0;0;0;0;0;0;0;0;0;0;0;0;0;0;0;0;0;0;0;0;0;0;0;0;0;0;0;0;0;0;0;0;1
TS001;Can numeral precede the noun?;not assignable;word order;NP;1;1;1;1;1;1;1;1;1;1;1;?;1;1;1;1;1;0;1;1;1;1;0;1;1;1;1;1;1;1;1;1;1;1;?;1;1;1;1;1;1;1;1;1;1;1;?;1;0;1;1;1;1;1;1;1;1;1;1;?
TS002;Can numeral follow the noun?;not assignable;word order;NP;0;0;0;1;0;0;0;0;0;0;0;?;0;1;1;0;0;1;0;0;0;0;1;1;0;0;1;0;0;0;0;0;0;0;?;0;1;0;1;?;0;0;0;0;?;0;?;0;1;0;0;0;0;0;0;1;0;0;0;?
TS003;Can demonstrative precede the noun?;not assignable;word order;NP;1;1;1;1;1;1;1;1;1;1;1;1;1;1;1;1;1;1;1;1;1;1;1;1;1;1;1;1;1;1;1;1;1;1;1;1;1;1;1;1;1;1;1;1;1;1;1;1;1;1;1;1;1;1;1;1;1;?;1;1
TS004;Can demonstrative follow the noun?;not assignable;word order;NP;0;0;0;0;0;0;0;0;0;0;0;0;0;0;0;0;0;0;0;0;0;0;0;0;0;0;0;0;0;0;0;0;0;0;0;0;0;0;0;0;0;0;0;0;0;0;0;0;0;0;0;0;0;0;0;0;0;?;0;0
TS005;Can adnominal possessor precede the possessed noun?;not assignable;word order;NP;1;1;1;?;1;1;1;1;1;1;1;1;1;1;1;1;1;1;1;1;1;1;1;1;1;1;1;1;1;1;1;1;1;1;1;1;1;1;1;1;1;1;1;1;1;1;1;1;1;1;1;1;1;1;1;1;1;1;1;1
TS006;Can adnominal possessor follow the possessed noun?;not assignable;word order;NP;1;1;1;?;0;1;1;1;1;1;1;1;1;1;0;1;1;0;1;1;1;1;0;0;1;0;0;1;1;1;1;1;1;1;0;0;0;1;0;0;1;1;1;1;1;1;0;1;0;0;1;1;1;1;1;1;1;1;1;0
TS007;Can adnominal property word precede the noun?;not assignable;word order;NP;1;1;1;1;1;?;1;1;1;1;1;1;1;1;1;1;1;1;1;1;1;1;1;1;1;1;1;1;1;1;1;1;1;1;1;1;1;?;1;1;1;1;1;1;1;1;1;1;1;1;1;1;1;1;1;1;1;1;1;1
TS008;Can adnominal property word follow the noun?;not assignable;word order;NP;0;0;0;0;0;?;0;0;0;0;0;0;0;0;0;0;0;0;0;0;0;0;0;0;0;0;0;0;0;0;0;0;0;0;0;0;0;?;0;0;0;0;0;0;0;0;0;0;0;0;0;0;0;0;0;0;0;0;0;0
TS009;Can adnominal collective universal quantifier (all) precede the noun?;not assignable;word order;NP;1;?;?;0;?;?;1;?;?;0;?;0;1;?;1;?;1;?;?;1;1;1;0;1;?;1;?;?;0;1;?;1;1;1;?;0;1;1;?;1;1;?;?;?;0;?;?;1;?;?;1;?;?;1;?;1;?;?;1;?
TS010;Can adnominal collective universal quantifier (all) follow the noun?;not assignable;word order;NP;0;?;?;1;?;?;0;?;?;1;?;1;0;?;?;?;0;?;?;0;0;0;1;1;?;0;?;?;1;0;?;0;0;0;?;1;0;0;?;?;0;?;?;?;1;?;?;0;?;?;0;?;?;0;?;1;?;?;1;?
TS079;Is there height vowel harmony?;not assignable;phonological distinctiveness;phonological shape;0;?;0;0;0;0;0;0;0;0;0;1;0;0;0;?;0;0;0;0;1;0;0;0;0;0;0;?;0;1;0;0;0;0;0;0;0;0;0;0;0;0;1;?;?;0;0;1;0;0;0;?;0;0;0;1;0;?;0;0
TS080;Is there labial vowel harmony?;not assignable;phonological distinctiveness;phonological shape;1;?;0;0;0;1;1;1;1;1;0;0;1;0;0;?;0;0;1;1;1;1;0;0;0;0;0;?;0;0;0;0;0;1;0;0;0;1;0;0;1;1;0;?;?;1;0;1;0;0;?;?;1;1;1;1;1;?;1;0
TS081;Is there an initial l-?;not assignable;phonological distinctiveness;phonological shape;?;?;?;?;?;?;?;?;1;0;?;?;?;?;?;?;?;?;?;0;?;?;?;1;?;?;?;?;?;?;?;?;1;?;?;?;?;?;?;?;?;0;?;?;?;?;?;?;?;1;?;?;?;?;?;?;1;?;?;?
TS082;Do numerals have the same form in attributive and predicative use?;numeral;NA;word;?;?;?;?;?;?;?;?;0;?;?;?;?;?;?;?;?;?;?;?;?;?;?;?;?;?;?;?;?;?;?;?;?;?;?;?;?;?;?;?;?;?;?;?;?;?;?;?;?;?;?;?;?;?;?;?;?;?;?;?
TS083;Are instrumental and comitative expressed by the same marker?;multiple;argument marking (non-core);word;?;?;?;?;?;?;?;?;?;0;?;0;?;?;?;?;?;?;?;?;?;?;?;?;?;1;?;?;?;?;?;?;?;?;?;?;?;?;?;?;?;?;?;?;?;?;?;?;?;?;?;?;?;?;?;?;?;?;?;?
TS083;Is the meaning to hunt expressed as noun+denominalizer?;verb;other;word;?;?;?;?;0;?;?;?;0;0;0;?;?;?;?;?;1;?;1;1;?;?;?;?;1;?;?;?;?;?;?;?;1;?;?;?;?;0;?;?;?;0;?;?;?;?;?;?;?;?;?;?;?;?;?;?;?;?;?;?
TS084;Are the meanings to see and to try expressed by formally identical verbs?;verb;other;word;?;?;?;?;?;?;?;?;1;1;?;?;?;?;?;?;?;?;?;?;?;?;?;?;?;?;?;?;?;?;?;?;?;?;?;?;?;?;?;?;?;?;?;?;?;?;?;?;?;?;?;?;?;?;?;?;?;?;?;?
TS085;What is the order of personal possessive suffixes and case suffixes?;not assignable;word order;word;?;?;?;?;0;?;1;?;?;1;?;?;?;?;?;?;?;?;1;1;?;?;?;?;?;0;?;?;?;?;?;1;?;?;?;?;?;?;?;?;1;?;?;?;?;?;?;?;?;?;?;?;?;?;?;?;1;?;?;?
TS086;Is the pragmatically unmarked order of SV in intransitive clauses?;not assignable;word order;clause;1;1;1;1;1;1;1;1;1;1;1;1;1;1;1;1;1;1;1;1;1;1;1;1;1;1;1;1;1;1;1;1;1;1;1;1;1;1;1;1;1;1;1;1;1;1;1;1;1;1;1;1;1;1;1;1;1;1;1;1
TS087;Is the pragmatically unmarked order of VS in intransitive clauses?;not assignable;word order;clause;0;0;0;0;0;0;0;0;0;0;0;0;0;0;0;0;0;0;0;0;0;0;0;0;0;0;0;0;0;0;0;0;0;0;0;0;0;0;0;0;0;0;0;0;0;0;0;0;0;0;0;0;0;0;0;0;0;0;0;0
TS088;Is there an aspiration distinction in stops?;not assignable;phonological distinctiveness;phonological shape;0;0;0;1;0;?;0;0;1;0;1;1;0;1;0;0;1;0;0;0;0;0;1;0;0;1;1;0;0;0;0;0;0;0;0;0;0;1;0;0;0;1;0;0;0;0;0;0;0;0;0;0;0;0;0;0;0;0;0;0