ID;Feature;PoS;Function;Level;Turkish;Bashkir;BeryozovkaEven;Bonan;Tsuken;Chagatai;Chuvash;CrimeanTatar;Dagur;Dolgan;Dongxiang;ShiraYughur;Gagauz;Khalkha;Hateruma;Solon;Mongghul;Ikema;KaraKalpak;Kazakh;Khakas;KhamnigalMongol;Korean;Manchu;MiddleMongol;MiddleKorean;Mangghuer;Moghol;MomaEven;Nanai;Negidal;Nogai;NorthernUzbek;Azerbaijani;Ura;Japanese;Ogami;Oirat;Okinoerabu;EasternOldJapanese;OldTurkic;Ordos;Oroch;Orok;Buriat;Shor;Shuri;Evenki;Yuwan;Tarama;Tatar;Kalmyk;Khalaj;Turkmen;Tuvan;Udihe;Uighur;Ulch;Yakut;Yonaguni
GB187;Is there any productive diminutive marking on the noun (exclude marking by system of nominal classification only)?;noun;denominal derivation;word;1;1;1;?;1;?;0;1;?;?;1;0;1;0;1;?;1;1;1;1;1;?;1;1;1;?;?;1;?;1;1;?;?;1;1;1;1;1;?;1;1;0;1;?;1;1;1;1;1;1;1;1;?;1;1;1;?;1;1;1
GB188;Is there any productive augmentative marking on the noun (exclude marking by system of nominal classification only)?;noun;denominal derivation;word;0;?;0;?;0;?;0;0;1;0;0;0;0;0;?;?;0;0;0;0;0;?;0;?;0;?;?;0;1;0;1;?;?;0;0;0;0;0;0;0;0;0;0;?;?;0;0;1;0;0;0;?;?;0;0;0;?;0;0;1
GB192;Is there a gender system where a noun's phonological properties are a factor in class assignment?;multiple;class agreement;clause;0;0;0;0;0;0;0;0;0;0;0;0;0;0;0;0;0;0;0;0;0;0;0;0;0;0;0;0;0;0;0;0;0;0;0;0;0;0;0;0;0;0;0;0;0;0;0;0;0;0;0;0;0;0;0;0;0;0;0;0
GB193;What is the order of adnominal property word and noun?;not assignable;word order;NP;1;1;1;1;1;?;1;1;1;1;1;1;1;1;1;1;1;1;1;1;1;1;1;1;1;1;1;1;1;1;1;1;1;1;1;1;1;?;1;1;1;1;1;1;1;1;1;1;1;1;1;1;1;1;1;1;1;1;1;1
GB196;Is there a male/female distinction in 2nd person independent pronouns?;pronoun;deixis;word;0;0;0;0;?;0;0;0;0;0;0;0;0;0;0;0;0;?;0;0;0;0;0;0;0;0;0;0;0;0;0;0;0;0;?;1;0;0;0;0;0;0;0;0;0;0;0;0;0;0;0;0;0;0;0;0;0;0;0;0
GB197;Is there a male/female distinction in 1st person independent pronouns?;pronoun;deixis;word;0;0;0;0;?;0;0;0;0;0;0;0;0;0;0;0;0;?;0;0;0;0;0;0;0;0;0;0;0;0;0;0;0;0;?;1;0;0;0;0;0;0;0;0;0;0;0;0;0;0;0;0;0;0;0;0;0;0;0;0
GB198;Can an adnominal numeral agree with the noun in gender/noun class?;numeral;class agreement;NP;0;0;0;0;0;0;0;0;0;0;0;0;0;0;0;0;0;0;0;0;0;0;0;0;0;0;0;0;0;0;0;0;0;0;0;0;0;0;0;0;0;0;0;0;0;0;0;0;0;0;0;0;0;0;0;0;0;0;0;0
GB203;What is the order of the adnominal collective universal quantifier ('all') and the noun?;not assignable;word order;NP;1;?;?;2;?;?;1;?;?;1;?;2;1;?;?;?;1;?;?;1;1;1;2;3;1;1;?;?;2;1;?;1;1;1;?;2;1;1;?;1;1;?;?;?;2;?;?;1;?;?;1;?;?;1;?;3;?;?;3;?
GB204;Do collective ('all') and distributive ('every') universal quantifiers differ in their forms or their syntactic positions?;other;quantification;multiple;1;1;?;?;?;?;1;1;?;1;?;?;1;1;?;?;?;?;?;0;1;?;1;0;?;1;?;?;1;1;?;1;1;0;?;1;1;?;?;?;1;?;?;?;1;?;?;1;?;?;1;?;?;1;0;1;?;1;1;?
GB250;Can predicative possession be expressed with a transitive 'habeo' verb?;verb;non-verbal predication;clause;0;0;?;0;?;?;0;0;0;0;0;?;0;0;1;0;0;1;0;0;?;?;0;0;?;?;0;?;0;0;0;?;0;0;?;1;0;?;?;?;0;0;?;0;0;0;?;0;0;1;?;0;0;0;0;0;?;?;0;0
GB252;Can predicative possession be expressed with an S-like possessum and a locative-coded possessor?;multiple;non-verbal predication;clause;0;1;?;1;?;?;0;1;1;0;1;?;1;1;1;1;1;?;1;1;1;1;1;1;?;?;1;?;1;1;0;?;1;1;?;1;1;?;?;?;?;?;?;1;?;0;?;0;1;?;?;1;0;1;1;1;?;?;0;1
GB253;Can predicative possession be expressed with an S-like possessum and a dative-coded possessor?;multiple;non-verbal predication;clause;0;0;?;1;?;?;0;0;1;1;1;?;0;1;0;1;1;?;0;0;?;1;0;1;?;?;1;?;0;1;1;?;1;0;?;1;0;?;?;?;1;?;?;1;?;0;?;1;0;?;?;1;0;0;0;1;?;?;0;0
GB254;Can predicative possession be expressed with an S-like possessum and a possessor that is coded like an adnominal possessor?;multiple;non-verbal predication;clause;1;1;?;0;?;?;1;1;0;0;0;?;1;0;0;1;0;?;1;1;1;?;1;0;?;1;0;1;0;0;0;?;1;1;?;0;0;?;?;?;?;0;1;1;1;1;?;1;1;?;?;0;1;1;0;1;?;?;0;0
GB256;Can predicative possession be expressed with an S-like possessor and a possessum that is coded like a comitative argument?;multiple;non-verbal predication;clause;0;0;?;0;?;?;0;0;1;1;?;?;0;1;0;1;?;?;0;0;?;1;0;0;?;?;0;?;0;1;0;?;0;0;?;0;0;?;?;?;?;?;?;?;1;0;?;0;0;?;?;1;0;0;0;1;?;?;1;0
GB257;Can polar interrogation be marked by intonation only?;not assignable;interrogation;clause;0;1;1;0;?;0;0;0;0;0;0;0;1;0;0;0;0;0;0;0;0;0;0;0;?;0;0;?;?;0;0;?;0;1;1;1;1;0;0;?;?;0;?;0;0;0;0;1;0;0;1;0;?;0;0;1;?;0;0;0
GB260;Can polar interrogation be indicated by a special word order?;multiple;interrogation;clause;0;0;0;0;0;0;0;0;0;0;0;0;0;0;0;0;0;0;0;0;0;0;0;0;?;0;0;?;?;0;0;?;0;0;0;0;0;0;0;0;0;0;?;0;0;0;0;0;0;0;0;0;?;0;0;0;0;0;0;0
GB262;Is there a clause-initial polar interrogative particle?;particle;interrogation;clause;0;0;0;0;0;0;0;0;0;0;0;0;0;0;0;0;0;0;0;0;0;0;0;0;?;0;0;?;?;0;0;0;0;0;0;0;0;0;0;0;0;0;0;0;0;0;0;0;0;0;0;0;?;0;0;0;?;0;0;0
GB263;Is there a clause-final polar interrogative particle?;particle;interrogation;clause;1;1;1;0;1;1;1;1;1;1;1;1;1;1;1;1;1;1;1;1;1;1;1;1;?;0;0;?;?;1;1;?;1;1;1;1;1;1;1;1;0;1;1;1;1;1;1;1;1;1;1;1;?;1;1;0;0;1;1;1
GB264;Is there a polar interrogative particle that most commonly occurs neither clause-initially nor clause-finally?;particle;word order;clause;0;0;0;0;0;0;0;0;0;0;0;0;0;0;0;0;0;0;0;0;0;0;0;0;?;0;0;?;?;0;0;?;0;0;0;0;0;0;0;1;1;0;0;0;0;0;0;0;0;0;0;0;?;0;0;0;?;1;0;0
GB265;Is there a comparative construction that includes a form that elsewhere means 'surpass, exceed'?;verb;non-verbal predication;clause;0;0;0;0;?;?;0;0;0;0;0;0;0;0;?;0;0;?;0;0;0;?;0;0;?;0;0;0;0;0;0;0;0;0;0;0;0;0;?;1;0;0;0;0;0;0;?;0;?;?;0;0;0;0;0;0;?;0;0;0
GB266;Is there a comparative construction that employs a marker of the standard which elsewhere has a locational meaning?;multiple;non-verbal predication;clause;1;1;1;1;?;?;1;1;1;1;1;1;1;1;1;1;1;?;1;1;1;?;0;1;?;0;1;1;1;0;1;1;1;1;0;0;0;1;?;?;1;1;1;0;1;1;?;1;?;?;1;1;1;1;1;1;?;0;?;0
GB270;Can comparatives be expressed using two conjoined clauses?;multiple;non-verbal predication;clause;0;0;0;0;?;?;0;0;0;0;0;0;0;0;?;0;0;?;0;0;0;?;0;0;?;0;0;0;0;0;0;0;0;0;0;0;0;0;?;?;0;0;0;0;0;0;?;0;?;?;0;0;0;0;0;0;?;0;0;0
GB273;Is there a comparative construction with a standard marker that elsewhere has neither a locational meaning nor a 'surpass/exceed' meaning?;particle;non-verbal predication;clause;0;0;0;0;?;?;0;0;0;1;0;0;0;0;1;0;0;?;0;0;0;?;1;1;?;1;0;0;0;1;0;0;0;0;1;1;1;0;1;?;0;1;0;1;0;0;?;0;1;?;0;0;0;0;0;0;?;1;1;1
GB275;Is there a bound comparative degree marker on the property word in a comparative construction?;adjective;non-verbal predication;word;0;1;1;0;?;?;1;1;0;0;0;0;0;0;?;0;?;?;1;0;0;?;0;0;?;0;?;1;1;0;0;1;1;0;0;0;0;?;0;?;0;0;0;0;0;0;?;1;?;?;1;0;1;1;0;0;?;0;0;?
GB276;Is there a non-bound comparative degree marker modifying the property word in a comparative construction?;particle;non-verbal predication;clause;1;0;0;0;?;?;0;0;0;0;0;0;1;0;?;0;?;?;0;0;0;?;1;0;?;0;0;0;0;0;0;1;0;0;0;0;0;?;0;?;0;0;0;0;0;0;?;0;?;?;0;0;0;0;0;0;?;0;0;?
GB285;Can polar interrogation be marked by a question particle and verbal morphology?;multiple;interrogation;clause;0;0;0;0;0;0;0;0;0;0;0;0;0;0;0;0;0;0;0;0;0;0;0;1;?;0;0;?;?;0;0;?;0;0;0;0;0;0;0;0;0;0;0;0;0;0;0;0;0;0;0;0;?;0;0;0;?;0;0;0
GB286;Can polar interrogation be indicated by overt verbal morphology only?;verb;interrogation;clause;0;0;1;1;0;0;0;0;0;0;0;0;0;0;0;0;0;0;0;0;0;0;0;0;?;0;1;?;?;0;0;0;0;0;0;0;1;0;0;0;0;0;0;0;0;0;0;0;0;0;0;1;?;0;0;0;?;0;0;0
GB291;Can polar interrogation be marked by tone?;not assignable;interrogation;clause;0;0;0;0;0;0;0;0;0;0;0;0;0;0;0;0;0;0;0;0;0;0;0;0;?;0;0;?;0;0;0;0;0;0;0;0;0;0;0;0;0;0;0;0;0;0;0;0;0;0;0;0;0;0;0;0;0;0;0;0
GB296;Is there a phonologically or morphosyntactically definable class of ideophones that includes ideophones depicting imagery beyond sound?;other;other;word;0;1;?;?;?;0;0;?;1;0;0;0;?;0;?;?;0;?;0;0;1;0;1;1;0;0;0;?;0;1;1;0;0;0;?;1;1;0;?;?;0;0;1;?;0;?;?;0;?;?;0;1;0;0;?;1;0;1;1;?
GB297;Can polar interrogation be indicated by a V-not-V construction?;verb;interrogation;clause;0;0;0;0;0;0;0;0;0;0;0;0;0;0;0;0;0;0;0;0;0;0;0;1;?;0;0;?;?;0;0;0;0;0;0;0;0;0;0;0;0;0;0;0;0;0;0;0;0;0;0;0;?;0;0;0;0;0;0;0
GB298;"Can standard negation be marked by an inflecting word (""auxiliary verb"")?";verb;negation;clause;0;0;1;0;0;0;0;0;0;0;0;0;0;?;0;1;1;0;0;0;0;0;0;0;0;?;0;0;1;1;1;0;0;0;0;0;0;0;0;0;0;0;1;1;0;0;0;1;0;1;0;0;0;0;0;1;0;1;0;1
GB299;"Can standard negation be marked by a non-inflecting word (""auxiliary particle"")?";particle;negation;clause;0;0;0;1;0;0;0;0;1;0;1;1;0;1;0;?;1;0;0;?;0;?;1;0;1;1;1;1;?;0;0;0;0;0;0;0;0;1;0;0;1;0;0;0;0;?;0;0;0;0;0;1;0;0;0;0;0;1;1;0
GB300;Does the verb for 'give' have suppletive verb forms?;verb;TAME+;word;0;?;0;0;?;0;0;?;0;0;0;0;0;0;0;?;0;?;0;0;?;0;?;0;?;0;0;?;?;0;0;0;0;0;?;0;0;0;?;0;0;0;?;?;0;0;0;0;?;?;0;?;0;0;?;0;0;?;0;?
GB301;Is there an inclusory construction?;multiple;deixis;clause;1;?;1;?;?;?;?;?;?;0;?;?;1;?;?;?;0;?;?;?;?;?;0;?;?;?;0;?;?;0;?;?;?;1;?;0;0;?;?;0;1;?;?;?;?;1;?;0;?;?;?;?;?;?;?;1;?;?;?;?
GB302;Is there a phonologically free passive marker ('particle' or 'auxiliary')?;particle;valency;clause;0;0;0;0;0;?;0;0;0;0;1;0;0;0;0;0;0;0;0;0;0;0;0;0;0;0;0;0;0;0;0;0;0;0;0;0;0;0;0;0;0;0;0;0;0;0;0;0;0;0;0;0;0;0;0;0;0;0;0;0
GB303;Is there a phonologically free antipassive marker ('particle' or 'auxiliary')?;particle;valency;clause;0;0;0;0;0;?;0;0;0;0;0;0;0;0;0;0;0;0;0;0;0;0;0;0;0;0;0;0;0;0;0;0;0;0;0;0;0;0;0;0;0;0;0;0;0;0;0;0;0;0;0;0;0;0;0;0;0;0;0;0
GB304;Can the agent be expressed overtly in a passive clause?;multiple;valency;clause;1;?;1;0;1;?;0;1;1;1;1;?;?;1;1;1;0;1;?;1;1;?;1;1;?;?;0;?;?;0;1;?;1;1;1;1;1;1;1;1;1;1;1;1;?;?;1;1;1;?;?;?;?;1;1;1;?;?;1;1
GB305;Is there a phonologically independent reflexive pronoun?;pronoun;valency;word;1;?;1;1;?;1;1;1;1;1;1;1;1;1;1;1;1;?;1;1;?;1;1;1;1;1;1;1;1;1;1;1;1;1;?;1;1;1;1;1;1;1;1;1;1;?;?;1;1;?;1;1;0;1;?;1;?;1;1;1
GB306;Is there a phonologically independent non-bipartite reciprocal pronoun?;pronoun;valency;word;0;?;?;?;?;0;0;0;0;0;0;?;0;0;?;0;0;?;0;0;?;0;1;1;0;?;?;?;?;0;?;0;0;0;?;1;?;0;1;0;0;0;0;?;0;?;?;?;?;?;?;0;0;?;?;0;?;?;0;0
GB309;Are there multiple past or multiple future tenses, distinguishing distance from Time of Reference?;verb;TAME;clause;0;0;0;?;0;1;1;1;0;?;0;0;1;0;0;1;0;0;1;1;1;0;1;1;1;0;0;0;?;0;1;1;1;1;0;0;0;0;0;0;1;0;0;?;0;1;0;1;0;0;0;0;1;1;0;1;1;0;1;0
GB312;Is there overt morphological marking on the verb dedicated to mood?;verb;TAME;word;1;1;1;1;1;1;1;1;1;1;1;1;1;1;1;1;1;1;1;1;1;1;1;1;1;1;1;1;1;1;1;1;1;1;1;1;1;0;1;1;1;1;1;1;1;1;1;1;1;1;1;1;1;1;1;1;1;1;1;1
GB313;Are there special adnominal possessive pronouns that are not formed by an otherwise regular process?;pronoun;possession;word;0;1;0;?;?;0;0;0;0;1;0;0;1;1;?;0;0;?;0;0;0;0;0;0;0;0;0;0;0;0;0;0;0;0;?;0;0;0;0;0;0;0;0;0;1;0;0;0;1;0;0;0;0;0;1;0;0;0;1;0
GB314;Can augmentative meaning be expressed productively by a shift of gender/noun class?;multiple;class agreement;word;0;0;0;0;0;0;0;0;0;0;0;0;0;0;0;0;0;0;0;0;0;0;0;0;0;0;0;0;0;0;0;0;0;0;0;0;0;0;0;0;0;0;0;0;0;0;0;0;0;0;0;0;0;0;0;0;0;0;0;0
GB315;Can diminutive meaning be expressed productively by a shift of gender/noun class?;multiple;class agreement;word;0;0;0;0;0;0;0;0;0;0;0;0;0;0;0;0;0;0;0;0;0;0;0;0;0;0;0;0;0;0;0;0;0;0;0;0;0;0;0;0;0;0;0;0;0;0;0;0;0;0;0;0;0;0;0;0;0;0;0;0
GB316;Is singular number regularly marked in the noun phrase by a dedicated phonologically free element?;particle;number;NP;0;0;0;0;0;0;0;0;0;0;0;0;0;0;0;0;0;0;0;0;0;0;0;0;0;0;1;0;0;0;0;0;0;0;0;0;0;0;0;0;0;0;0;0;0;0;0;0;0;0;0;0;0;0;0;0;0;0;0;0
GB317;Is dual number regularly marked in the noun phrase by a dedicated phonologically free element?;particle;number;NP;0;0;0;0;0;0;0;0;0;0;0;0;0;0;0;0;0;0;0;0;0;0;0;0;0;0;0;0;0;0;0;0;0;0;0;0;0;0;0;0;0;0;0;0;0;0;0;0;0;0;0;0;0;0;0;0;0;0;0;0
GB318;Is plural number regularly marked in the noun phrase by a dedicated phonologically free element?;particle;number;NP;0;0;0;0;0;0;0;0;0;0;0;0;0;0;0;0;0;0;0;0;0;0;0;0;0;0;1;0;0;0;0;0;0;0;0;0;0;0;0;0;0;0;0;0;0;0;0;0;0;0;0;0;0;0;0;0;0;0;0;0
GB319;Is trial number regularly marked in the noun phrase by a dedicated phonologically free element?;particle;number;NP;0;0;0;0;0;0;0;0;0;0;0;0;0;0;0;0;0;0;0;0;0;0;0;0;0;0;0;0;0;0;0;0;0;0;0;0;0;0;0;0;0;0;0;0;0;0;0;0;0;0;0;0;0;0;0;0;0;0;0;0
GB320;Is paucal number regularly marked in the noun phrase by a dedicated phonologically free element?;particle;number;NP;0;0;0;0;0;0;0;0;0;0;0;0;0;0;0;0;0;0;0;0;0;0;0;0;0;0;0;0;0;0;0;0;0;0;0;0;0;0;0;0;0;0;0;0;0;0;0;0;0;0;0;0;0;0;0;0;0;0;0;0
GB321;Is there a large class of nouns whose gender/noun class is not phonologically or semantically predictable?;multiple;class agreement;word;0;0;0;0;0;0;0;0;0;0;0;0;0;0;0;0;0;0;0;0;0;0;0;0;0;0;0;0;0;0;0;0;0;0;0;0;0;0;0;0;0;0;0;0;0;0;0;0;0;0;0;0;0;0;0;0;0;0;0;0
GB322;Is there grammatical marking of direct evidence (perceived with the senses)?;verb;TAME;clause;0;0;0;0;0;0;1;0;0;0;0;1;0;1;0;0;1;?;0;0;0;0;1;0;0;?;0;0;0;0;0;0;0;0;0;0;0;1;0;?;0;1;0;?;0;0;0;0;0;0;0;1;0;1;?;1;0;0;1;1
GB323;Is there grammatical marking of indirect evidence (hearsay, inference, etc.)?;verb;TAME;clause;0;0;0;0;0;?;?;1;0;0;0;0;1;0;1;0;0;?;0;1;1;0;0;0;0;0;1;0;0;0;0;0;1;0;1;0;1;0;1;?;1;0;0;?;0;0;0;0;0;0;1;1;0;0;?;1;1;0;0;0
GB324;Is there an interrogative verb for content interrogatives (who?, what?, etc.)?;verb;interrogation;clause;0;0;0;1;?;?;0;?;0;0;0;1;1;1;?;0;?;?;0;1;?;1;0;1;0;?;1;1;?;1;0;0;0;0;?;1;0;0;1;0;?;0;?;1;1;1;0;1;?;?;0;1;0;?;1;0;1;1;1;?
GB325;Is there a count/mass distinction in interrogative quantifiers?;particle;quantification;word;1;0;?;?;?;?;0;0;0;0;0;1;0;1;?;0;?;?;0;1;1;1;1;0;1;1;?;0;?;0;?;0;0;0;?;0;0;0;0;?;0;0;0;0;0;0;?;0;1;?;?;0;?;0;1;0;?;?;1;?
GB326;Do (nominal) content interrogatives normally or frequently occur in situ?;not assignable;word order;clause;1;0;?;1;?;?;1;1;1;1;?;1;1;1;?;1;?;?;?;?;1;1;1;1;?;1;1;?;?;1;?;1;0;1;1;1;1;?;1;1;1;?;?;1;1;1;?;0;1;1;1;1;?;1;?;0;?;?;1;1
GB327;Can the relative clause follow the noun?;not assignable;word order;clause;0;0;1;0;0;1;0;0;0;0;0;0;1;0;0;0;0;0;0;?;1;0;0;0;?;0;0;?;?;0;?;0;0;1;0;0;0;0;0;0;1;1;?;0;0;?;0;0;0;0;0;0;1;0;?;1;0;0;0;0
GB328;Can the relative clause precede the noun?;not assignable;word order;clause;1;1;?;1;1;1;1;1;1;1;1;1;1;1;1;1;1;1;1;?;1;1;1;1;?;1;1;?;?;1;?;1;1;1;1;1;1;1;1;1;1;0;1;1;1;?;1;1;1;1;1;1;1;1;?;1;1;1;1;1
GB329;Are there internally-headed relative clauses?;not assignable;word order;clause;0;0;?;0;0;0;0;0;0;0;0;0;0;0;?;0;0;?;0;?;0;0;0;1;?;0;0;?;?;0;?;0;0;?;0;1;0;0;?;0;0;0;?;?;0;0;?;1;0;?;0;?;0;?;?;1;0;?;1;?
GB330;Are there correlative relative clauses?;not assignable;word order;clause;0;0;0;?;0;0;0;0;0;0;0;0;0;0;?;0;0;?;0;?;0;0;0;0;?;0;0;?;?;0;?;0;0;?;0;0;0;0;0;0;1;0;?;0;?;0;0;0;0;0;0;0;0;?;?;0;0;?;0;?
GB331;Are there adjoined relative clauses?;not assignable;word order;clause;0;0;0;?;0;0;0;0;0;0;0;0;0;0;?;0;0;?;0;?;0;0;0;0;?;0;0;?;?;0;?;0;0;?;0;0;0;0;0;0;0;0;?;0;?;0;0;0;0;0;0;0;0;?;?;0;0;?;0;?
GB333;Is there a decimal numeral system?;other;quantification;word;1;1;1;1;?;?;1;1;1;1;1;1;1;1;?;1;1;?;1;1;1;1;1;1;1;1;1;1;1;1;1;1;1;1;?;1;1;1;1;?;1;1;1;1;1;1;?;1;1;?;1;1;1;1;1;1;?;1;1;?
GB334;Is there synchronic evidence for any element of a quinary numeral system?;other;quantification;word;0;0;0;0;?;?;0;0;0;0;0;0;0;0;?;0;0;?;0;0;0;0;0;0;0;0;0;?;0;0;0;0;0;0;?;0;0;0;0;0;0;0;0;0;0;0;?;0;0;?;0;0;0;0;0;0;?;0;0;0
GB335;Is there synchronic evidence for any element of a vigesimal numeral system?;other;quantification;word;0;0;0;0;?;?;0;0;0;0;0;0;0;0;?;0;0;?;0;0;0;0;0;0;0;0;0;?;0;0;0;0;0;0;?;0;0;0;0;?;0;0;0;0;0;0;?;0;0;?;0;0;0;0;0;0;?;0;0;?
GB336;Is there a body-part tallying system?;noun;quantification;word;0;0;0;0;0;0;0;0;0;0;0;0;0;0;?;0;0;?;0;0;0;0;0;0;0;0;0;0;0;0;0;0;0;0;?;0;0;0;0;0;0;0;0;0;0;0;?;0;0;?;0;0;0;0;0;0;0;0;0;0
GB400;Are all person categories neutralized in some voice, tense, aspect, mood and/or negation?;verb;TAME;clause;0;?;0;?;0;0;1;0;0;0;0;1;0;0;0;?;0;0;0;0;0;?;0;0;0;0;0;0;0;0;0;0;0;0;0;0;0;0;0;0;0;0;0;?;0;0;0;0;0;0;1;?;0;1;0;1;0;0;0;0
GB401;Is there a class of patient-labile verbs?;verb;valency;clause;0;?;?;?;?;?;0;?;?;?;?;?;1;?;?;?;?;?;0;0;?;?;?;?;?;1;?;1;?;0;?;?;?;0;?;1;?;?;?;0;?;?;?;?;?;?;?;0;?;?;?;?;?;?;?;0;?;?;?;1
GB402;Does the verb for 'see' have suppletive verb forms?;verb;TAME+;word;0;?;0;0;?;0;0;?;0;0;0;0;0;0;0;?;0;?;0;0;?;0;?;0;?;0;0;?;?;0;0;0;0;0;?;0;0;0;?;0;0;0;?;?;0;?;0;0;?;?;0;?;0;0;0;0;0;0;0;?
GB403;Does the verb for 'come' have suppletive verb forms?;verb;TAME+;word;0;?;0;0;?;0;0;?;0;0;0;0;0;0;?;?;0;?;0;0;?;0;?;0;?;0;0;?;?;0;0;0;0;0;1;1;1;0;?;0;0;0;?;?;0;?;1;0;?;?;0;?;0;0;0;0;0;?;0;?
GB408;Is there any accusative alignment of flagging?;multiple;argument marking (core);clause;1;1;1;1;1;1;1;1;1;1;1;1;1;1;0;1;1;1;1;1;1;1;1;1;1;1;1;1;1;1;1;1;1;1;1;1;1;1;1;1;1;1;1;1;1;1;1;1;1;1;1;1;1;1;1;1;1;1;1;1
GB409;Is there any ergative alignment of flagging?;multiple;argument marking (core);clause;0;?;0;0;0;0;0;0;0;0;0;0;0;?;0;0;0;0;0;0;0;0;?;0;0;0;0;0;0;0;0;0;0;0;0;0;0;0;0;1;0;0;0;0;?;0;0;0;0;0;0;0;0;0;0;?;0;0;0;0
GB410;Is there any neutral alignment of flagging?;multiple;argument marking (core);clause;1;1;0;1;0;?;1;1;1;1;1;1;1;1;1;0;1;0;1;1;?;1;1;1;1;0;1;0;0;0;0;?;?;1;0;0;0;1;0;0;?;1;0;0;1;1;0;0;0;0;0;1;1;1;1;1;1;0;1;0
GB415;Is there a politeness distinction in 2nd person forms?;pronoun;deixis;word;0;0;0;0;?;1;1;0;0;0;0;1;1;0;0;0;0;?;1;1;0;1;1;0;0;1;0;0;0;0;0;0;1;0;?;1;0;0;1;0;0;0;0;0;1;0;1;0;1;0;0;1;0;0;0;0;1;1;0;0
GB421;Is there a preposed complementizer in complements of verbs of thinking and/or knowing?;not assignable;word order;clause;1;?;0;?;?;?;0;1;0;0;0;?;1;0;?;0;0;?;0;1;?;?;0;0;?;?;0;?;?;0;?;0;0;?;0;0;0;?;0;0;0;0;?;0;?;?;?;0;0;?;1;?;1;?;?;0;?;?;0;0
GB422;Is there a postposed complementizer in complements of verbs of thinking and/or knowing?;not assignable;word order;clause;0;?;0;?;?;?;0;?;0;0;0;?;0;0;1;0;0;?;0;0;?;?;1;0;?;?;0;?;?;0;?;0;1;?;1;1;1;?;0;?;?;0;?;0;?;?;?;0;1;?;0;?;0;?;?;0;?;?;0;1
GB430;Can adnominal possession be marked by a prefix on the possessor?;multiple;possession;word;0;0;0;0;0;0;0;0;0;0;0;0;0;0;0;0;0;0;0;0;0;0;0;0;0;0;0;0;0;0;0;0;0;0;0;0;0;0;0;0;0;0;0;0;0;0;0;0;0;0;0;0;0;0;0;0;0;0;0;0
GB431;Can adnominal possession be marked by a prefix on the possessed noun?;multiple;possession;word;0;0;0;0;0;0;0;0;0;0;0;0;0;0;1;0;0;0;0;0;0;0;0;0;0;0;0;0;0;0;0;0;0;0;0;0;0;0;0;0;0;0;0;0;0;0;0;0;0;0;0;0;0;0;0;0;0;0;0;0
GB432;Can adnominal possession be marked by a suffix on the possessor?;multiple;possession;word;1;1;0;1;1;1;1;1;1;0;1;1;1;1;1;1;1;1;1;1;1;1;1;1;1;1;1;1;0;0;0;1;1;1;1;1;1;1;1;1;1;1;0;1;1;1;1;1;1;1;1;0;1;1;1;0;1;0;0;1
GB433;Can adnominal possession be marked by a suffix on the possessed noun?;multiple;possession;word;1;1;1;?;0;1;1;1;1;1;1;1;1;1;0;1;1;0;1;1;1;1;0;0;1;0;1;1;1;1;1;1;1;1;0;0;0;1;0;0;1;1;1;1;1;1;0;1;0;0;1;1;1;1;1;1;1;1;1;0
GB519;"Can mood be marked by a non-inflecting word (""auxiliary particle"")?";particle;TAME;clause;0;0;0;0;0;0;0;1;0;1;0;0;1;0;0;0;0;1;0;0;0;1;0;0;0;0;0;0;0;0;0;0;1;0;0;1;1;0;0;0;1;0;0;?;0;0;0;0;?;0;1;0;?;1;0;0;0;0;0;0
GB520;"Can aspect be marked by a non-inflecting word (""auxiliary particle"")?";particle;TAME;clause;0;0;0;0;0;0;0;0;0;0;0;0;0;0;0;0;0;0;0;0;0;0;0;0;0;0;0;0;0;0;0;0;0;0;0;0;1;0;0;0;0;0;0;?;0;0;0;0;0;0;0;0;0;1;0;0;0;0;0;0
GB521;"Can tense be marked by a non-inflecting word (""auxiliary particle"")?";particle;TAME;clause;0;0;0;1;0;0;0;1;0;0;0;0;0;0;0;0;0;0;0;0;0;0;0;0;1;0;0;0;0;0;0;0;0;0;0;0;0;0;0;0;0;0;0;?;0;0;0;0;0;0;0;0;0;0;0;0;0;0;1;0
GB522;"Can the S or A argument be omitted from a pragmatically unmarked clause when the referent is inferrable from context (""pro-drop"" or ""null anaphora"")?";not assignable;argument marking (core);clause;1;1;1;1;1;1;1;1;1;1;1;?;1;1;1;?;1;1;?;1;1;1;1;1;1;1;1;1;1;1;?;1;1;1;1;1;1;1;1;1;?;1;1;?;1;1;?;0;1;1;1;?;1;1;1;1;1;?;?;1
TE001;Is root structure predominantly polysyllabic?;multiple;NA;NA;1;0;?;?;?;?;0;?;?;?;?;?;?;?;?;?;?;?;?;?;?;1;1;?;?;?;?;?;?;?;?;?;?;1;?;1;1;?;1;?;?;?;?;?;?;?;?;0;1;?;?;?;?;?;?;1;?;?;?;?
TE002;Are complex tonal distinctions lacking?;multiple;NA;NA;1;1;1;1;1;?;1;1;1;1;1;?;1;1;1;?;?;?;1;1;1;1;1;1;?;0;1;1;1;1;1;1;1;1;1;1;1;1;1;?;1;1;1;1;1;1;1;1;0;1;1;1;1;1;1;1;1;1;1;0
TE003;Is there palatal vowel harmony?;not assignable;phonological distinctiveness;phonological shape;1;1;0;0;0;1;1;1;1;1;0;1;1;?;0;0;0;0;1;1;0;1;1;0;1;0;0;0;?;0;0;1;1;1;0;0;0;1;0;0;1;1;0;0;1;1;0;0;0;0;1;1;1;1;1;0;1;1;1;0
TE004;Is there tongue root vowel harmony?;not assignable;phonological distinctiveness;phonological shape;0;0;1;0;0;0;0;0;0;0;0;0;0;?;0;1;0;0;0;0;0;0;0;1;0;1;0;0;?;0;1;0;0;0;0;0;0;0;0;0;0;0;1;1;0;0;0;1;0;0;0;0;0;0;0;0;0;0;0;0
TE005;Is there an initial velar nasal?;not assignable;phonological distinctiveness;phonological shape;0;0;1;1;0;?;0;0;0;0;0;?;0;0;0;0;?;0;?;0;0;0;0;0;?;?;0;?;1;1;1;?;0;0;0;0;0;?;0;1;?;0;1;1;0;0;0;1;0;0;0;0;0;0;0;1;0;1;0;?
TE006;Is there an initial r-?;not assignable;phonological distinctiveness;phonological shape;0;0;0;1;?;?;0;?;0;0;?;?;0;0;0;0;1;?;?;0;0;0;1;0;?;?;1;?;0;0;0;?;1;0;?;1;1;?;1;?;0;0;0;0;0;?;1;0;1;1;?;?;0;1;0;0;1;0;0;?
TE007;Are there initial consonant clusters in native words?;not assignable;phonological distinctiveness;phonological shape;0;0;0;1;0;?;0;0;0;0;0;1;0;0;0;0;1;1;?;0;0;0;0;0;0;1;1;0;?;0;0;?;?;0;0;0;1;0;0;?;0;0;0;0;0;0;0;0;0;1;?;0;0;0;0;0;0;0;0;0
TE008;Is there a voicing distinction in stops?;not assignable;phonological distinctiveness;phonological shape;1;1;1;1;1;?;0;1;0;1;1;0;1;0;1;1;0;1;1;1;1;1;0;1;1;0;0;1;1;1;1;1;1;1;1;1;0;1;1;1;1;0;1;1;1;1;1;1;1;1;1;1;1;1;1;1;1;1;1;1
TE009;Are borrowed verbs accommodated through a light-verb or a verbalizer?;verb;NA;NA;1;?;?;?;?;?;1;?;?;?;?;?;1;1;?;1;?;?;?;?;?;?;1;?;?;?;?;?;?;?;?;?;?;?;?;1;?;?;?;?;?;?;?;?;?;?;?;0;?;?;?;?;?;?;?;?;?;?;?;?
TE012;Are property words verbally or nominally encoded?;adjective;NA;word;0;?;0;1;0;?;0;?;?;?;0;?;?;?;?;0;0;0;0;?;0;0;1;1;?;?;0;0;0;0;?;?;?;0;?;1;0;?;?;?;?;0;0;0;?;0;0;0;?;0;0;?;0;0;?;0;?;0;0;0
TE014;Is there partial emphatic reduplication of nominal property words?;adjective;other;word;1;1;0;1;1;?;1;?;1;?;1;?;?;?;?;1;?;0;1;1;?;?;0;0;?;?;?;?;0;1;0;?;1;1;?;0;1;?;?;?;1;?;1;?;1;1;?;?;?;1;?;1;1;1;?;0;?;0;0;?
TE015;Are morphemes connected linearly in a way that there is a one on one relationship between a morpheme and its meaning?;multiple;NA;NA;1;1;1;1;1;1;1;1;1;1;1;1;1;1;1;1;1;1;1;1;1;1;1;1;?;1;1;1;1;1;1;1;1;1;1;1;1;1;1;1;1;1;1;1;1;1;1;1;1;1;1;1;1;1;1;1;1;1;1;1
TE016;Is inflectional morphology predominantly suffixing?;word;NA;word;1;1;1;1;1;1;1;1;1;1;1;1;1;1;1;1;1;1;1;1;1;1;1;1;1;1;1;1;1;1;1;1;1;1;1;1;1;1;1;0;1;1;1;1;1;1;1;1;1;1;1;1;1;1;1;1;1;1;1;0
TE018;Is there a mi-ti opposition in 1 vs. 2 SG personal pronouns?;pronoun;phonological distinctiveness;phonological shape;1;0;0;1;?;1;1;1;1;0;1;1;0;1;0;1;1;?;1;1;1;1;0;1;1;0;1;1;1;1;1;1;1;1;?;0;0;1;0;0;1;1;1;1;1;1;0;1;0;0;1;?;1;1;1;1;1;1;0;0
TE019;Is the secondary oblique stem of personal pronouns formed with a dental nasal?;pronoun;phonological distinctiveness;phonological shape;1;1;1;1;?;1;1;1;1;1;1;1;1;1;0;1;0;?;1;1;1;1;0;1;1;0;1;1;1;1;1;1;1;1;?;0;0;1;0;0;1;0;1;1;1;1;0;1;0;0;1;1;1;1;1;1;1;1;0;0
TE022;Are gerunds or adverbial participles used to mark adverbial subordination?;NA;NA;NA;1;1;?;?;1;1;1;1;1;?;?;?;?;1;1;1;1;1;1;?;1;?;1;1;?;1;?;0;1;1;1;1;1;1;?;1;1;?;1;1;1;0;1;1;1;1;?;1;?;?;?;1;?;1;1;1;1;?;?;1
TE025;Are specific non-finite and finite suffixes expressed by a formally identical suffix?;NA;NA;NA;1;?;?;?;?;?;?;?;?;?;?;?;?;?;?;?;?;?;?;?;?;?;?;?;?;?;?;?;?;?;?;?;?;?;?;1;?;?;?;?;?;?;?;?;?;?;?;?;?;?;?;?;?;?;?;?;?;?;?;?
TE026;Are specific negative verbs and negative suffixes/particles expressed by a formally identical suffix?;NA;NA;NA;0;0;0;?;?;?;?;?;?;?;?;?;0;1;0;?;?;0;?;?;?;0;1;1;?;?;0;0;?;?;0;?;?;?;?;1;?;?;0;0;?;?;0;?;?;0;0;?;?;?;0;?;?;?;?;0;?;0;?;0
TE027;Can 1PL marker be augmented by a collective plural marker?;pronoun;deixis;word;1;0;0;1;?;1;?;0;0;0;0;1;0;1;0;0;1;?;1;0;0;1;1;0;0;1;0;1;0;0;1;1;1;1;?;0;0;1;0;0;1;0;0;?;1;0;0;0;0;1;0;1;0;1;0;0;?;0;0;1
TE028;Do core adjectives (defined semantically as property concepts such as value, shape, age, dimension) act like nouns in predicative position?;adjective;non-verbal predication;word;0;1;;?;;;1;;;;;;;1;;1;;;;;;1;?;?;?;0;1;1;;;0;;;?;;1;0;;;;;;1;;?;1;;1;1;;1;?;;;;1;;1;1;
TE029;"Do core adjectives (defined semantically as property concepts; value, shape, age, dimension) used attributively require the same morphological treatment as nouns?";adjective;other;word;0;0;;?;;;1;;;;;;;1;;1;;;;;;1;?;?;?;0;1;1;;1;0;;;?;;1;0;;;;;;1;;1;1;;1;1;;1;?;;;;1;;1;1;
TE031;Is there a non-initial velar nasal?;not assignable;phonological distinctiveness;phonological shape;0;1;1;1;0;?;0;1;1;1;1;1;0;1;0;1;1;0;1;0;1;1;1;1;1;1;0;1;1;1;1;1;1;0;0;0;0;1;0;1;1;1;1;1;1;1;0;1;0;0;1;1;1;1;1;1;1;1;0;1
TE033;Is there a reciprocal marker that is distinct from the reflexive marker?;pronoun;valency;NA;1;?;1;1;?;1;1;1;?;0;?;?;?;1;?;?;?;?;1;1;?;1;1;1;?;?;?;?;0;1;?;?;1;?;?;1;?;?;1;0;1;?;1;?;?;?;?;1;?;?;?;1;1;?;1;1;1;?;1;?
TE034;Are there deranked purpose clauses?;NA;NA;NA;1;?;?;?;?;?;1;?;?;?;?;?;?;?;?;?;?;?;?;?;?;?;1;?;?;?;?;?;?;1;?;?;?;?;?;1;1;?;?;?;?;?;?;?;?;1;?;?;?;?;?;?;?;?;?;?;?;?;?;?
TE036;Can the notional subject of a want complement clause be left implicit when it is coreferential with the wanter?;NA;NA;NA;1;?;?;?;?;?;?;?;?;?;?;?;?;?;?;?;?;?;?;?;?;?;1;?;?;?;?;?;?;1;?;?;?;?;?;1;?;?;?;?;?;?;?;?;?;1;?;?;?;?;?;?;?;?;?;1;?;?;?;?
TE037;Is there a voicing distinction in fricatives?;not assignable;phonological distinctiveness;phonological shape;1;1;0;1;1;?;0;1;0;1;0;1;1;1;1;0;1;1;1;1;1;0;0;1;1;1;0;1;0;0;0;1;1;1;0;1;0;1;1;0;1;0;1;0;1;1;0;0;0;1;1;1;1;1;1;0;1;0;0;0
TE038;Are there two separate liquid phonemes (r/l)?;not assignable;phonological distinctiveness;phonological shape;1;1;1;1;0;?;1;1;1;1;1;1;1;1;0;1;1;0;1;1;1;1;0;1;1;0;1;1;1;1;0;1;1;1;0;0;0;1;0;0;1;1;1;0;1;1;0;1;0;0;1;1;1;1;1;0;1;1;1;0
TE039;Is there vowel length distinction?;not assignable;phonological distinctiveness;phonological shape;0;0;1;1;1;?;0;0;1;1;0;1;1;1;?;1;1;1;1;0;1;1;1;0;1;0;0;0;1;1;1;0;0;0;?;1;1;1;1;0;1;1;1;1;1;1;1;1;1;1;0;1;1;1;1;1;1;1;1;0
