ID;Feature;PoS;Function;Level;Turkish;Bashkir;BeryozovkaEven;Bonan;Tsuken;Chagatai;Chuvash;CrimeanTatar;Dagur;Dolgan;Dongxiang;ShiraYughur;Gagauz;Khalkha;Hateruma;Solon;Mongghul;Ikema;KaraKalpak;Kazakh;Khakas;KhamnigalMongol;Korean;Manchu;MiddleMongol;MiddleKorean;Mangghuer;Moghol;MomaEven;Nanai;Negidal;Nogai;NorthernUzbek;Azerbaijani;Ura;Japanese;Ogami;Oirat;Okinoerabu;EasternOldJapanese;OldTurkic;Ordos;Oroch;Orok;Buriat;Shor;Shuri;Evenki;Yuwan;Tarama;Tatar;Kalmyk;Khalaj;Turkmen;Tuvan;Udihe;Uighur;Ulch;Yakut;Yonaguni
GB020;Are there definite or specific articles?;article;deixis;NP;0;0;0;0;0;0;0;0;0;0;0;0;0;0;0;0;1;0;0;0;0;1;0;0;0;0;0;0;0;0;0;0;0;0;0;0;0;0;0;0;0;0;0;0;0;0;0;0;0;0;0;0;0;0;0;1;0;0;0;0
GB021;Do indefinite nominals commonly have indefinite articles?;article;deixis;NP;0;0;0;0;0;0;0;0;0;0;1;0;0;0;0;0;0;0;0;0;0;0;0;1;0;0;0;0;0;0;0;0;0;0;0;0;0;0;0;0;0;0;0;0;0;0;0;0;0;0;0;0;0;0;0;0;0;0;0;0
GB022;Are there prenominal articles?;article;deixis;NP;1;0;0;0;0;0;0;1;0;1;1;0;1;0;0;0;1;0;1;?;1;0;0;1;0;0;0;0;0;0;0;1;1;0;0;0;0;0;0;0;1;0;1;0;0;0;0;0;0;0;0;0;1;1;0;0;0;0;0;0
GB023;Are there postnominal articles?;article;deixis;NP;0;0;0;0;0;0;0;0;0;0;0;0;0;0;0;0;1;0;0;0;0;1;0;0;0;0;1;0;0;0;0;0;0;0;0;0;0;0;0;0;0;0;0;0;0;0;0;0;0;0;0;0;0;0;0;1;0;0;0;0
GB024;What is the order of numeral and noun in the NP?;not assignable;word order;NP;1;1;1;3;1;1;1;1;1;1;1;?;1;1;3;1;1;2;1;1;1;1;2;3;1;1;3;1;1;1;1;1;1;1;?;1;3;1;3;1;1;1;1;1;1;1;?;1;2;?;1;1;1;1;1;3;1;1;1;?
GB025;What is the order of adnominal demonstrative and noun?;not assignable;word order;NP;1;?;1;1;1;1;1;1;1;1;1;1;1;1;1;1;1;1;1;1;1;1;1;1;1;1;1;1;1;1;1;1;1;1;1;1;1;1;1;1;1;1;1;1;1;1;1;1;1;1;1;1;1;1;1;1;1;?;1;1
GB026;Can adnominal property words occur discontinuously?;not assignable;word order;NP;1;?;1;0;0;?;0;?;?;?;0;0;?;?;?;1;0;?;?;?;?;0;?;?;?;?;0;?;?;1;1;?;0;0;0;0;0;?;?;0;?;0;?;?;0;?;0;?;?;0;?;?;1;0;?;1;0;0;1;?
GB027;Are nominal conjunction and comitative expressed by different elements?;multiple;argument marking (non-core);NP;0;1;?;?;?;?;0;1;1;0;?;?;0;1;?;?;?;?;1;0;1;?;0;?;1;0;?;?;0;1;0;0;1;1;?;0;0;?;?;0;1;?;0;1;1;0;?;1;?;?;1;?;0;0;?;1;?;?;1;?
GB028;Is there an inclusive/exclusive distinction?;pronoun;deixis;word;0;0;1;1;?;0;0;0;1;0;1;1;0;0;0;1;0;?;0;0;0;1;0;1;1;0;0;1;0;0;1;0;0;0;?;0;0;1;0;0;0;1;1;0;0;0;0;1;0;0;0;0;0;0;0;1;0;0;0;0
GB030;Is there a gender distinction in independent 3rd person pronouns?;pronoun;deixis;word;0;0;0;0;?;0;0;0;0;0;0;0;0;0;0;0;0;?;0;0;0;0;0;0;0;0;0;0;0;0;0;0;0;0;?;1;0;0;0;0;0;0;0;0;0;0;0;0;0;0;0;0;0;0;0;0;0;0;0;0
GB031;Is there a dual or unit augmented form (in addition to plural or augmented) for all person categories in the pronoun system?;pronoun;deixis;word;0;0;0;0;?;0;0;0;0;1;0;0;0;?;0;0;0;?;0;0;0;0;0;0;0;0;0;0;0;0;0;0;0;0;?;0;0;0;0;0;0;0;0;0;0;0;0;0;1;0;0;0;0;0;0;0;0;0;1;0
GB035;Are there three or more distance contrasts in demonstratives?;demonstrative;deixis;word;1;0;0;0;?;0;1;1;0;1;0;0;0;0;0;0;0;?;0;1;1;0;1;0;0;1;0;0;0;0;0;?;1;0;?;1;0;0;1;1;0;0;0;0;0;1;1;0;1;?;1;0;0;0;0;0;1;0;1;1
GB036;Do demonstratives show an elevation distinction?;demonstrative;deixis;word;0;0;0;0;?;0;0;0;0;0;0;0;0;0;0;0;0;?;0;0;0;0;0;0;0;0;0;0;0;0;0;0;0;0;?;0;0;0;0;0;0;0;0;0;0;0;0;0;0;?;0;0;0;0;0;0;0;0;0;0
GB037;Do demonstratives show a visible-nonvisible distinction?;demonstrative;deixis;word;0;0;0;1;?;0;0;0;0;0;0;0;0;0;0;0;0;?;1;0;0;0;0;0;0;0;0;0;0;0;0;?;0;0;?;0;0;0;0;0;0;0;0;0;0;0;0;0;0;?;0;0;0;0;0;0;0;0;0;0
GB038;Are there demonstrative classifiers?;noun;deixis;word;0;0;0;0;0;0;0;0;0;0;0;0;0;0;0;0;0;0;0;0;0;0;0;0;0;0;0;0;0;0;0;0;0;0;0;0;0;0;0;0;0;0;0;0;0;0;0;0;0;0;0;0;0;0;0;0;0;0;0;0
GB039;Is there nonphonological allomorphy of noun number markers?;noun;number;word;0;0;1;0;1;0;0;0;1;0;0;1;0;1;0;0;1;?;0;0;0;0;?;0;1;1;0;1;0;0;?;0;0;0;1;1;0;1;0;0;0;1;0;0;0;0;0;0;1;0;0;1;0;0;0;0;0;0;0;0
GB041;Are there several nouns (more than three) which are suppletive for number?;noun;number;word;0;0;0;0;?;0;0;0;0;0;0;0;0;0;0;?;0;0;0;0;?;1;0;0;0;0;0;?;0;0;0;0;0;0;?;0;0;0;0;0;0;0;0;?;0;0;0;0;0;0;0;0;0;0;0;0;0;0;0;?
GB042;Is there productive overt morphological singular marking on nouns?;noun;number;word;0;0;0;0;0;0;0;0;0;0;0;0;0;0;0;0;1;0;0;0;0;0;0;0;0;0;0;0;0;0;0;0;0;0;0;0;0;0;0;0;0;0;0;0;0;0;0;0;0;0;0;0;0;0;0;0;0;0;0;0
GB043;Is there productive morphological dual marking on nouns?;noun;number;word;0;0;0;1;0;0;0;0;0;0;0;0;0;0;0;0;0;0;0;0;0;0;0;0;0;0;0;0;0;0;0;0;0;0;0;0;0;0;0;0;0;0;0;0;0;0;0;0;0;0;0;0;0;0;0;0;0;0;0;0
GB044;Is there productive morphological plural marking on nouns?;noun;number;word;1;1;1;1;?;1;1;1;1;1;1;1;1;1;0;1;1;1;1;1;1;0;1;0;0;0;1;1;1;1;1;1;1;1;1;0;0;1;0;0;1;1;0;0;1;1;0;1;0;1;1;1;1;1;1;0;1;1;1;1
GB046;Is there an associative plural marker for nouns?;noun;number;word;1;1;?;1;?;?;1;?;?;?;?;?;1;0;?;1;?;?;?;?;1;?;1;?;1;0;1;?;1;1;1;?;?;1;?;1;1;?;1;0;?;?;1;?;0;1;?;1;1;?;?;?;1;1;?;1;1;?;1;1
GB047;Is there a productive morphological pattern for deriving an action/state noun from a verb?;noun;denominal derivation;word;1;1;?;1;1;?;1;1;?;1;?;0;1;1;?;?;1;?;1;1;1;?;1;1;1;1;?;1;1;1;?;1;?;1;?;1;0;1;1;?;1;1;1;?;1;1;?;1;?;?;1;1;1;1;1;1;?;1;1;?
GB048;Is there a productive morphological pattern for deriving an agent noun from a verb?;noun;denominal derivation;word;1;1;?;1;?;?;0;1;?;?;1;1;1;1;?;?;?;?;?;?;0;1;1;1;1;0;?;1;1;1;?;?;?;1;?;0;1;1;1;?;1;1;1;?;1;1;?;1;1;?;1;?;1;1;1;0;?;1;1;?
GB049;Is there a productive morphological pattern for deriving an object noun from a verb?;noun;denominal derivation;word;1;1;?;1;?;?;1;1;?;1;1;0;1;1;?;?;1;?;1;?;1;?;1;1;1;1;?;1;1;0;1;?;?;1;?;1;0;1;0;?;1;1;1;?;1;1;?;1;?;?;1;1;1;1;1;1;?;1;1;?
GB051;Is there a noun class/gender system where sex is a factor in class assignment?;multiple;class agreement;word;0;0;0;0;0;0;0;0;0;0;0;0;0;0;0;0;0;0;0;0;0;0;0;0;0;0;0;0;0;0;0;0;0;0;0;0;0;0;0;0;0;0;0;0;0;0;0;0;0;0;0;0;0;0;0;0;0;0;0;0
GB052;Is there a noun class/gender system where shape is a factor in class assignment?;multiple;class agreement;word;0;0;0;0;0;0;0;0;0;0;0;0;0;0;0;0;0;0;0;0;0;0;0;0;0;0;0;0;0;0;0;0;0;0;0;0;0;0;0;0;0;0;0;0;0;0;0;0;0;0;0;0;0;0;0;0;0;0;0;0
GB053;Is there a noun class/gender system where animacy is a factor in class assignment?;multiple;class agreement;word;0;0;0;0;0;0;0;0;0;0;0;0;0;0;0;0;0;0;0;0;0;0;0;0;0;0;0;0;0;0;0;0;0;0;0;0;0;0;0;0;0;0;0;0;0;0;0;0;0;0;0;0;0;0;0;0;0;0;0;0
GB054;Is there a noun class/gender system where plant status is a factor in class assignment?;multiple;class agreement;word;0;0;0;0;0;0;0;0;0;0;0;0;0;0;0;0;0;0;0;0;0;0;0;0;0;0;0;0;0;0;0;0;0;0;0;0;0;0;0;0;0;0;0;0;0;0;0;0;0;0;0;0;0;0;0;0;0;0;0;0
GB057;Are there numeral classifiers?;noun;quantification;word;0;0;0;0;?;0;0;1;0;0;1;0;0;0;1;0;0;?;0;0;0;0;1;0;0;?;1;0;0;1;1;0;0;0;?;1;1;0;1;1;0;0;?;0;0;0;1;1;1;1;0;0;0;0;0;0;0;1;0;1
GB058;Are there possessive classifiers?;noun;possession;word;0;0;0;0;0;0;0;0;0;0;0;0;0;0;0;0;0;0;0;0;0;0;0;0;0;0;0;0;0;0;0;0;0;0;0;0;0;0;0;0;0;0;0;0;0;0;0;0;0;0;0;0;0;0;0;0;0;0;0;0
GB059;Is the adnominal possessive construction different for alienable and inalienable nouns?;noun;possession;word;0;0;1;0;0;0;1;0;0;0;0;0;0;0;0;0;0;0;0;0;0;0;0;0;0;0;0;0;0;1;1;0;0;0;0;0;0;0;?;0;?;0;1;1;0;0;0;1;0;?;0;?;0;0;0;1;0;1;0;0
GB065;What is the pragmatically unmarked order of adnominal possessor noun and possessed noun?;not assignable;word order;NP;1;3;3;?;1;3;3;3;3;3;3;3;3;3;1;1;3;1;3;3;1;3;1;1;3;1;1;3;3;3;3;3;3;3;1;1;1;3;1;1;3;3;3;3;3;3;1;3;1;1;3;3;3;3;3;3;3;3;3;1
GB068;Do core adjectives (defined semantically as property concepts such as value, shape, age, dimension) act like verbs in predicative position?;adjective;non-verbal predication;word;0;0;0;0;1;?;0;1;0;1;0;0;1;0;1;0;0;0;?;?;0;0;1;0;0;1;0;0;0;0;0;0;0;0;1;1;0;0;?;1;0;0;0;0;?;0;1;0;1;1;0;0;0;0;?;0;0;0;0;1
GB069;"Do core adjectives (defined semantically as property concepts; value, shape, age, dimension) used attributively require the same morphological treatment as verbs?";adjective;other;word;0;0;0;0;1;?;0;0;0;0;0;0;0;0;0;0;0;0;?;?;0;0;1;0;0;1;0;0;0;0;0;0;0;0;1;1;0;0;?;1;0;0;0;0;0;0;1;0;?;1;0;0;0;0;?;0;0;0;0;1
GB070;Are there morphological cases for non-pronominal core arguments (i.e. S/A/P)?;noun;argument marking (core);word;1;1;1;1;1;1;1;1;1;1;1;1;1;1;1;1;1;1;1;1;1;1;1;0;1;1;1;1;1;1;1;1;1;1;1;1;1;1;1;1;1;1;1;1;1;1;1;1;1;1;1;1;1;1;1;1;1;1;1;1
GB071;Are there morphological cases for pronominal core arguments (i.e. S/A/P)?;pronoun;argument marking (core);word;1;1;1;1;1;1;1;1;1;1;1;1;1;1;1;1;1;?;1;1;1;1;0;1;1;1;1;1;1;1;1;1;1;1;1;1;1;1;1;1;1;1;1;1;1;1;1;1;1;1;1;1;1;1;1;1;1;1;1;1
GB072;Are there morphological cases for oblique non-pronominal NPs (i.e. not S/A/P)?;noun;argument marking (non-core);word;1;1;1;1;1;1;1;1;1;1;1;1;1;1;1;1;1;1;1;1;1;1;1;0;1;1;1;1;1;1;1;1;1;1;1;1;1;1;1;1;1;1;1;1;1;1;1;1;1;1;1;1;1;1;1;1;1;1;1;1
GB073;Are there morphological cases for oblique independent personal pronouns (i.e. not S/A/P)?;pronoun;argument marking (non-core);word;1;1;1;1;1;1;1;1;1;1;1;1;1;1;1;1;1;?;1;1;1;1;1;1;1;1;1;1;1;1;1;1;1;1;1;1;1;1;1;1;1;1;1;1;1;1;1;1;?;1;1;1;1;1;1;1;1;1;1;1
GB074;Are there prepositions?;other;argument marking (non-core);NP;0;0;0;0;0;1;0;0;0;0;0;0;0;0;0;0;0;0;0;0;0;?;0;0;0;0;0;?;0;0;0;0;0;0;0;0;0;0;0;0;0;0;0;0;0;0;0;0;0;0;0;0;0;0;?;0;0;0;0;0
GB075;Are there postpositions?;other;argument marking (non-core);NP;1;1;1;1;1;1;1;1;1;1;1;1;1;1;?;1;1;1;1;1;1;?;1;1;1;1;1;?;1;1;1;1;1;1;1;1;1;1;1;1;1;1;1;1;1;1;1;1;1;1;1;1;1;1;?;1;1;1;1;1
GB079;Do verbs have prefixes/proclitics, other than those that ONLY mark A, S or O (do include portmanteau: A & S + TAM)?;verb;TAME+;word;0;0;0;0;0;0;0;0;0;0;0;0;0;0;0;0;0;0;0;0;0;0;0;0;0;0;0;0;0;0;0;0;0;0;0;0;0;0;0;1;0;0;0;0;0;0;0;0;0;0;0;0;0;0;0;0;0;0;0;0
GB080;Do verbs have suffixes/enclitics, other than those that ONLY mark A, S or O (do include portmanteau: A & S + TAM)?;verb;TAME+;word;1;1;1;1;1;1;1;1;1;1;1;1;1;1;1;1;1;1;1;1;1;1;1;1;1;1;1;1;1;1;1;1;1;1;1;1;1;1;1;1;1;1;1;1;1;1;1;1;1;1;1;1;1;1;1;1;1;1;1;1
GB081;Is there productive infixation in verbs?;verb;TAME+;word;0;0;0;0;0;0;0;0;0;0;0;0;0;0;0;0;0;0;0;0;0;0;0;0;0;0;0;0;0;0;0;0;0;0;0;0;0;0;0;0;0;0;0;0;0;0;0;0;0;0;0;0;0;0;0;0;0;0;0;0
GB082;Is there overt morphological marking of present tense on verbs?;verb;TAME;word;1;1;1;0;1;1;1;1;1;1;1;1;1;1;1;1;1;1;1;1;1;1;0;1;1;1;?;1;1;1;1;1;1;1;1;1;0;1;1;0;0;1;1;1;1;1;1;1;1;1;1;0;1;1;1;0;1;1;0;1
GB083;Is there overt morphological marking on the verb dedicated to past tense?;verb;TAME;word;1;1;1;1;0;1;1;1;1;1;1;1;1;1;1;1;1;1;1;1;1;1;1;1;1;1;1;1;0;1;1;1;1;1;1;1;1;1;1;1;1;1;1;1;1;1;1;1;1;1;1;1;1;1;1;1;1;1;1;1
GB084;Is there overt morphological marking on the verb dedicated to future tense?;verb;TAME;word;1;1;1;1;0;1;0;1;0;0;0;1;1;0;0;1;0;?;0;0;1;0;1;1;0;0;?;?;1;1;1;1;1;1;0;0;0;0;0;1;1;0;1;1;0;1;0;1;0;0;1;0;0;1;1;1;0;1;1;0
GB086;Is a morphological distinction between perfective and imperfective aspect available on verbs?;verb;TAME;word;1;0;1;1;1;1;0;1;1;0;1;1;0;1;1;1;1;?;1;1;1;1;0;1;0;1;1;1;0;0;1;1;1;0;1;1;1;?;1;1;1;1;1;?;1;1;1;1;1;0;0;1;0;1;1;1;1;1;0;1
GB089;Can the S argument be indexed by a suffix/enclitic on the verb in the simple main clause?;verb;argument marking (core);word;1;1;1;0;0;1;1;1;1;1;1;0;1;0;0;1;0;0;1;1;1;1;0;0;1;0;0;1;1;1;1;1;1;1;0;0;0;1;0;0;1;0;1;1;1;1;0;1;0;0;1;0;1;1;1;1;1;1;1;0
GB090;Can the S argument be indexed by a prefix/proclitic on the verb in the simple main clause?;verb;argument marking (core);word;0;0;0;0;0;0;0;0;0;0;0;0;0;0;0;0;0;0;0;0;0;0;0;0;0;0;0;0;0;0;0;0;0;0;0;0;0;0;0;0;0;0;0;0;0;0;0;0;0;0;0;0;0;0;0;0;0;0;0;0
GB091;Can the A argument be indexed by a suffix/enclitic on the verb in the simple main clause?;verb;argument marking (core);word;1;1;1;0;0;1;1;1;1;1;1;0;1;0;0;1;0;0;1;1;1;1;0;0;1;0;0;1;1;1;1;1;1;1;0;0;0;1;0;0;1;0;1;1;1;1;0;1;0;0;1;0;1;1;1;1;1;1;1;0
GB092;Can the A argument be indexed by a prefix/proclitic on the verb in the simple main clause?;verb;argument marking (core);word;0;0;0;0;0;0;0;0;0;0;0;0;0;0;0;0;0;0;0;0;0;0;0;0;0;0;0;0;0;0;0;0;0;0;0;0;0;0;0;0;0;0;0;0;0;0;0;0;0;0;0;0;0;0;0;0;0;0;0;0
GB093;Can the P argument be indexed by a suffix/enclitic on the verb in the simple main clause?;verb;argument marking (core);word;0;0;0;0;0;0;0;0;0;0;0;0;0;0;0;0;0;0;0;0;0;0;0;0;0;0;0;0;0;0;0;0;0;0;0;0;0;0;0;0;0;0;0;0;0;0;0;0;0;0;0;0;0;0;0;0;0;0;0;0
GB094;Can the P argument be indexed by a prefix/proclitic on the verb in the simple main clause?;verb;argument marking (core);word;0;0;0;0;0;0;0;0;0;0;0;0;0;0;0;0;0;0;0;0;0;0;0;0;0;0;0;0;0;0;0;0;0;0;0;0;0;0;0;0;0;0;0;0;0;0;0;0;0;0;0;0;0;0;0;0;0;0;0;0
GB095;Are variations in marking strategies of core participants based on TAM distinctions?;verb;argument marking (core);word;0;?;0;0;0;0;0;0;0;0;0;0;0;0;0;0;0;0;0;0;0;0;0;0;0;0;0;0;0;0;0;0;0;0;0;0;0;0;0;0;0;0;0;0;0;0;0;0;0;0;0;0;0;0;0;0;0;0;0;0
GB096;Are variations in marking strategies of core participants based on verb classes?;verb;argument marking (core);word;0;?;0;0;0;0;0;0;0;0;0;0;0;0;0;0;0;0;0;0;0;0;0;0;0;0;0;0;0;0;0;0;0;0;0;0;0;0;0;0;0;0;0;0;0;0;0;0;0;0;0;0;0;0;0;0;0;0;0;0
GB098;Are variations in marking strategies of core participants based on person distinctions?;verb;argument marking (core);word;0;?;0;0;0;0;0;0;0;0;0;0;0;0;0;0;0;0;0;0;0;0;0;0;0;0;0;0;0;0;0;0;0;0;0;0;0;0;0;0;0;0;0;0;0;0;0;0;0;0;0;0;0;0;0;0;0;0;0;0
GB099;Can verb stems alter according to the person of a core participant?;verb;argument marking (core);word;0;?;0;0;0;0;0;0;0;0;0;0;0;0;0;0;0;0;0;0;0;0;0;0;?;0;0;?;?;0;0;0;0;0;0;0;0;0;0;0;0;0;0;0;?;0;0;0;0;0;0;0;0;0;0;0;0;0;0;0
GB103;Is there a benefactive applicative marker on the verb (including indexing)?;verb;argument marking (non-core);word;0;0;0;?;0;0;0;0;0;0;0;0;0;0;0;0;0;0;0;0;0;0;0;0;0;1;0;0;0;0;0;0;0;0;0;0;0;0;0;1;0;0;0;0;0;0;0;0;0;0;0;0;0;0;0;0;0;0;0;0
GB104;Is there an instrumental applicative marker on the verb (including indexing)?;verb;argument marking (non-core);word;0;0;0;?;0;0;0;0;0;0;0;0;0;0;0;0;0;0;0;0;0;0;0;0;0;0;0;0;0;0;0;0;0;0;0;0;0;0;0;0;0;0;0;0;0;0;0;0;0;0;0;0;0;0;0;0;0;0;0;0
GB105;Can the recipient in a ditransitive construction be marked like the monotransitive patient?;verb;argument marking (non-core);word;0;0;0;1;0;0;1;0;0;0;0;0;0;0;0;0;0;?;0;0;0;0;1;0;0;0;1;?;0;0;0;0;0;?;0;1;0;0;0;0;0;0;0;0;?;0;0;0;0;?;0;0;0;0;?;0;0;0;0;0
GB107;Can standard negation be marked by an affix, clitic or modification of the verb?;verb;negation;word;1;1;1;0;1;1;1;1;0;1;0;0;1;1;1;0;0;1;1;1;1;?;1;1;0;?;0;0;?;1;0;1;1;1;1;1;1;0;1;1;1;1;1;0;1;1;1;0;1;1;1;0;1;1;1;0;1;1;1;1
GB108;Is there directional or locative morphological marking on verbs?;verb;argument marking (non-core);word;0;?;1;0;0;0;0;0;0;0;0;0;0;?;0;1;0;?;0;0;0;0;0;1;0;0;0;?;1;0;1;0;0;0;0;0;1;0;0;1;0;0;1;0;0;0;0;1;0;0;0;0;0;0;0;0;0;0;0;0
GB109;Is there verb suppletion for participant number?;verb;argument marking (core);word;0;?;0;0;0;0;0;0;0;0;0;0;0;0;0;0;0;0;0;0;0;0;?;0;0;0;0;?;?;0;0;0;0;0;0;0;0;0;0;0;0;0;0;0;0;0;0;0;0;0;0;?;0;0;0;0;0;0;0;0
GB110;Is there verb suppletion for tense or aspect?;verb;TAME;word;0;?;0;0;?;0;0;?;0;0;0;0;0;0;?;0;0;?;0;0;0;0;?;0;0;0;0;?;?;0;0;0;0;0;1;0;0;0;0;?;0;0;0;0;0;0;?;0;?;?;0;?;0;0;0;0;0;0;0;?
GB111;Are there conjugation classes?;verb;TAME+;word;0;?;1;?;1;0;1;0;0;0;0;0;0;0;1;?;0;1;0;0;?;0;1;1;0;0;0;?;1;1;?;0;0;0;1;1;1;0;1;1;0;0;1;1;0;0;1;1;?;1;0;?;0;0;?;1;0;1;0;1
GB113;Are there verbal affixes or clitics that turn intransitive verbs into transitive ones?;verb;valency;word;1;1;1;1;?;?;1;1;1;1;1;1;1;1;1;1;1;?;1;1;1;?;1;1;1;1;1;1;1;1;?;1;1;1;?;1;1;1;1;1;1;1;1;1;1;1;1;1;?;?;1;1;1;1;1;1;?;1;1;?
GB114;Is there a phonologically bound reflexive marker on the verb?;verb;valency;word;1;1;0;0;?;?;1;1;0;1;0;0;1;1;?;?;0;?;1;1;1;?;1;0;0;0;0;?;?;0;?;1;1;1;0;0;0;0;0;0;1;0;1;?;0;1;?;0;?;?;1;1;1;1;1;1;?;1;1;0
GB115;Is there a phonologically bound reciprocal marker on the verb?;verb;valency;word;1;1;1;1;?;?;1;1;1;1;1;1;1;1;?;1;1;?;1;1;1;?;1;1;1;0;1;?;1;0;1;1;1;1;0;1;?;1;0;0;0;0;1;?;1;1;?;1;?;?;1;1;1;1;1;1;?;0;1;0
GB116;Do verbs classify the shape, size or consistency of absolutive arguments by means of incorporated nouns, verbal affixes or suppletive verb stems?;verb;argument marking (core);word;0;0;0;0;0;0;0;0;0;0;0;0;0;0;0;0;0;0;0;0;0;0;0;0;0;0;0;0;0;0;0;0;0;0;0;0;0;0;0;0;0;0;0;0;0;0;0;0;0;0;0;0;0;0;0;0;0;0;0;0
GB117;Is there a copula for predicate nominals?;verb;non-verbal predication;clause;1;1;1;1;1;1;0;1;?;1;1;1;1;1;1;1;?;1;?;0;1;0;1;1;1;1;1;?;?;1;?;1;1;1;?;1;0;1;1;1;1;1;1;1;1;1;1;1;1;1;1;?;1;?;?;1;1;1;1;1
GB118;Are there serial verb constructions?;verb;verb complex;clause;1;?;?;?;?;0;0;0;0;0;0;1;0;?;?;?;?;?;0;0;?;1;1;0;0;0;1;?;?;0;?;0;0;0;0;0;1;0;?;1;0;0;?;0;?;1;?;0;?;?;0;?;?;0;?;0;0;0;0;?
GB119;"Can mood be marked by an inflecting word (""auxiliary verb"")?";verb;TAME;clause;1;1;0;1;0;1;1;1;1;1;1;1;0;1;1;1;0;0;1;1;1;1;0;1;1;0;0;?;0;0;1;1;1;1;?;0;1;1;0;0;1;0;1;?;1;1;0;1;0;0;1;1;0;1;0;1;1;?;1;1
GB120;"Can aspect be marked by an inflecting word (""auxiliary verb"")?";verb;TAME;clause;1;1;0;1;0;1;1;0;1;1;1;1;0;1;1;1;0;1;1;1;1;1;1;1;0;0;0;?;0;0;0;1;1;1;1;1;1;?;1;0;1;1;0;?;1;1;1;1;1;1;1;1;0;1;0;1;1;?;1;1
GB121;"Can tense be marked by an inflecting word (""auxiliary verb"")?";verb;TAME;clause;1;0;0;0;0;1;1;0;0;1;1;1;0;0;0;1;0;0;1;0;1;1;0;1;?;0;0;?;0;1;1;1;1;1;1;0;0;1;0;0;1;1;0;?;0;1;0;1;0;0;1;1;1;0;0;1;1;1;1;0
GB122;Is verb compounding a regular process?;verb;verb complex;word;0;?;?;?;?;0;0;0;0;0;0;0;0;0;1;?;0;?;0;0;?;0;1;0;0;1;0;?;?;0;?;?;0;0;0;1;0;0;?;?;0;0;?;0;0;0;1;0;1;?;?;?;?;0;?;0;?;1;0;1
GB123;Are there verb-adjunct (aka light-verb) constructions?;verb;verb complex;clause;1;?;?;?;1;?;1;1;0;1;?;0;1;?;1;1;?;1;?;?;1;0;1;?;?;?;?;?;?;0;?;?;?;1;1;1;?;?;1;1;1;0;?;?;?;?;?;?;1;?;1;?;?;1;?;1;?;?;1;1
GB124;Is incorporation of nouns into verbs a productive intransitivizing process?;verb;valency;word;0;0;0;0;0;0;0;0;0;0;0;0;0;0;0;0;0;0;0;0;0;0;0;0;0;0;0;0;0;0;0;0;0;0;0;0;0;0;0;0;0;0;0;0;0;?;0;?;0;0;0;0;0;0;0;0;0;0;0;0
GB126;Is there an existential verb?;verb;non-verbal predication;clause;1;1;1;0;1;1;0;1;?;1;1;?;0;0;1;?;1;1;1;1;?;?;1;0;?;1;0;?;?;0;?;?;1;1;?;1;1;?;1;0;1;?;?;1;0;1;1;0;1;?;?;?;1;?;?;1;1;0;1;1
GB127;Are different posture verbs used obligatorily depending on an inanimate locatum's shape or position (e.g. 'to lie' vs. 'to stand')?;verb;non-verbal predication;clause;0;?;?;0;?;?;0;?;?;1;?;?;0;0;0;0;?;0;?;?;?;?;?;0;?;?;0;?;?;0;?;?;?;0;0;0;0;?;0;?;?;?;?;0;?;?;0;?;0;?;?;?;?;?;?;0;0;?;1;0
GB129;Is there a notably small number, i.e. about 100 or less, of verb roots in the language?;verb;other;word;0;0;0;0;0;0;0;0;0;0;0;0;0;0;0;0;0;0;0;0;0;0;0;0;0;0;0;0;0;0;0;0;0;0;0;0;0;0;0;0;0;0;0;0;0;0;0;0;0;0;0;0;0;0;0;0;0;0;0;0
GB130;What is the pragmatically unmarked order of S and V in intransitive clauses?;not assignable;word order;clause;1;1;1;1;1;1;1;1;1;3;1;1;3;1;1;1;1;1;1;1;1;1;1;1;1;1;1;1;1;1;1;1;1;1;1;1;1;1;1;1;1;1;1;1;1;1;1;1;1;1;1;1;1;1;1;1;1;1;1;1
GB131;Is a pragmatically unmarked constituent order verb-initial for transitive clauses?;verb;word order;clause;0;0;0;0;0;0;0;0;0;0;0;0;0;0;0;0;0;0;0;0;0;0;0;0;0;0;0;0;0;0;0;0;0;0;0;0;0;0;0;0;0;0;0;0;0;0;0;0;0;0;0;0;0;0;0;0;0;0;0;0
GB132;Is a pragmatically unmarked constituent order verb-medial for transitive clauses?;verb;word order;clause;0;0;1;0;0;0;0;0;0;0;0;0;1;0;0;0;0;0;0;0;0;0;0;0;0;0;0;1;0;0;0;0;0;0;0;0;0;0;0;0;0;0;0;0;0;0;0;0;0;0;0;0;1;0;0;0;0;0;0;0
GB133;Is a pragmatically unmarked constituent order verb-final for transitive clauses?;verb;word order;clause;1;1;1;1;1;1;1;1;1;1;1;1;1;1;1;1;1;1;1;1;1;1;1;1;1;1;1;1;1;1;1;1;1;1;1;1;1;1;1;1;1;1;1;1;1;1;1;1;1;1;1;1;1;1;1;1;1;1;1;1
GB134;Is the order of constituents the same in main and subordinate clauses?;not assignable;word order;clause;1;1;0;1;1;1;1;1;1;1;1;1;1;?;1;1;1;?;?;?;?;1;1;1;1;1;1;?;?;1;1;1;1;1;1;1;1;?;1;1;1;1;?;1;?;1;1;1;1;?;1;?;0;1;?;1;1;?;1;1
GB135;Do clausal objects usually occur in the same position as nominal objects?;not assignable;word order;clause;1;?;?;?;1;1;1;1;1;1;1;?;1;1;?;1;1;?;1;1;1;?;1;0;?;1;1;1;?;1;?;1;1;0;1;1;1;?;?;1;?;0;?;1;1;?;?;0;1;?;1;1;?;?;?;0;?;1;?;1
GB136;Is the order of core argument (i.e. S/A/P) constituents fixed?;not assignable;word order;clause;1;?;0;1;?;?;1;1;?;1;1;?;0;1;1;0;?;0;0;1;1;?;0;0;?;1;1;0;?;0;0;?;?;1;0;0;0;?;?;0;1;?;?;?;?;1;0;0;0;0;?;0;1;1;?;0;1;0;1;0
GB137;Can standard negation be marked clause-finally?;verb;negation;clause;1;1;1;0;1;1;1;1;0;1;0;1;1;0;1;0;0;1;1;1;1;1;0;1;0;?;0;0;?;1;1;1;1;1;1;1;1;0;1;1;1;1;1;0;1;1;1;0;1;1;1;1;1;1;1;0;1;1;1;1
GB138;Can standard negation be marked clause-initially?;verb;negation;clause;0;0;0;0;0;0;0;0;0;0;0;0;0;0;0;?;0;0;0;0;0;0;0;0;0;?;0;1;?;0;0;0;0;0;0;0;0;0;0;0;0;0;1;?;0;0;0;0;0;0;0;0;0;0;0;0;0;0;0;0
GB139;Is there a difference between imperative (prohibitive) and declarative negation constructions?;verb;negation;clause;0;0;?;1;1;1;1;?;1;1;1;1;0;1;1;0;1;1;0;?;0;1;1;1;1;?;1;1;0;1;1;?;?;1;1;1;1;1;1;1;0;?;1;0;1;0;?;0;1;1;0;1;0;0;?;0;0;1;1;1
GB140;Is verbal predication marked by the same negator as all of the following types of predication: locational, existential and nominal?;verb;non-verbal predication;clause;0;0;0;0;0;0;0;0;0;0;0;0;0;0;1;0;0;0;1;0;0;0;1;0;0;?;0;0;?;1;?;?;0;0;0;1;0;0;0;0;0;?;?;0;?;0;0;0;0;1;?;0;0;0;?;0;?;?;0;1
GB146;Is there a morpho-syntactic distinction between predicates expressing controlled versus uncontrolled events or states?;noun;argument marking (core);multiple;0;?;0;?;?;?;0;?;?;?;1;?;?;?;?;?;1;?;?;0;?;?;1;?;?;?;1;0;0;1;?;?;?;0;?;1;?;?;?;?;0;?;1;?;?;0;0;0;1;?;?;?;0;?;?;1;?;?;0;0
GB147;Is there a morphological passive marked on the lexical verb?;verb;valency;word;1;1;1;0;1;1;0;1;1;1;0;1;1;1;1;1;0;1;1;1;1;?;1;1;1;1;0;1;1;0;1;1;1;1;1;1;1;1;1;1;1;1;1;1;1;1;1;1;1;1;1;1;1;1;1;1;?;1;1;1
GB148;Is there a morphological antipassive marked on the lexical verb?;verb;valency;word;0;0;0;0;0;0;0;0;0;0;?;0;0;0;0;0;0;0;0;0;0;0;0;0;0;0;0;0;0;0;0;0;0;0;0;0;0;0;0;0;0;0;0;0;0;0;0;0;?;0;0;0;0;0;0;0;0;0;0;0
GB149;Is there a morphologically marked inverse on verbs?;verb;argument marking (core);word;0;0;0;0;0;0;0;0;0;0;0;0;0;0;0;0;0;0;0;0;0;0;0;0;0;0;0;0;0;0;0;0;0;0;0;0;0;0;0;0;0;0;0;0;0;0;0;0;0;0;0;0;0;0;0;0;0;0;0;0
GB150;Is there clause chaining?;verb;verb complex;clause;1;1;?;0;1;1;1;1;1;1;1;1;0;1;1;1;1;1;1;1;1;1;1;1;1;1;1;0;?;1;1;1;1;1;1;1;1;1;1;1;1;1;1;1;?;1;1;1;1;?;?;1;?;1;1;1;?;?;1;1
GB151;"Is there an overt verb marker dedicated to signalling coreference or noncoreference between the subject of one clause and an argument of an adjacent clause (""switch reference"")?";verb;argument marking (core);clause;0;0;?;0;0;0;0;0;0;0;0;0;0;0;0;0;0;0;0;0;0;0;0;0;0;0;0;0;?;0;0;0;0;0;0;0;0;0;0;0;0;0;?;0;0;0;0;0;0;0;0;0;0;0;0;1;0;0;0;0
GB152;Is there a morphologically marked distinction between simultaneous and sequential clauses?;verb;TAME;clause;1;1;1;?;1;1;0;0;1;1;1;1;?;1;1;1;1;1;1;1;1;1;1;1;1;?;0;1;1;1;0;1;1;0;1;0;1;1;?;1;1;1;1;1;1;1;1;1;1;?;1;0;0;1;1;1;?;1;1;?
GB155;Are causatives formed by affixes or clitics on verbs?;verb;valency;word;1;1;1;1;1;?;1;1;1;1;1;1;1;1;1;1;1;1;1;1;1;?;1;1;1;1;1;1;?;1;1;1;1;1;1;1;1;1;1;1;1;1;1;1;1;1;1;1;1;1;1;1;1;1;1;1;?;1;1;1
GB156;Is there a causative construction involving an element that is unmistakably grammaticalized from a verb for 'to say'?;verb;valency;word;0;0;0;0;0;?;0;0;0;0;0;0;0;0;0;0;0;0;0;0;0;0;1;0;0;0;0;0;0;0;?;0;0;0;0;0;0;0;0;0;0;0;0;0;0;0;0;0;0;0;0;0;0;0;0;0;0;0;0;0
GB158;Are verbs reduplicated?;verb;TAME+;word;0;?;?;1;?;0;0;?;0;0;0;0;?;?;?;0;0;0;0;0;?;0;0;0;?;?;0;?;0;0;?;?;0;0;1;0;0;?;?;1;0;0;0;?;0;0;?;0;?;0;0;0;0;0;1;0;?;0;0;?
GB159;Are nouns reduplicated?;noun;number;word;0;?;?;0;?;0;0;1;0;0;0;?;0;?;?;0;0;0;0;0;?;0;1;0;?;?;0;?;0;0;?;0;1;?;0;0;0;?;?;1;0;0;0;?;0;0;?;0;?;0;0;1;0;1;?;0;?;0;0;?
GB160;Are elements apart from verbs or nouns reduplicated?;adjective;other;word;1;1;?;1;1;?;1;1;1;0;1;?;?;0;?;0;?;0;1;1;1;?;1;0;?;?;0;?;0;1;?;?;1;1;?;1;1;?;?;1;1;0;1;?;1;?;?;1;1;1;0;1;1;1;?;1;?;1;1;?
GB165;Is there productive morphological trial marking on nouns?;noun;number;word;0;0;0;0;0;0;0;0;0;0;0;0;0;0;0;0;0;0;0;0;0;0;0;0;0;0;0;0;0;0;0;0;0;0;0;0;0;0;0;0;0;0;0;0;0;0;0;0;0;0;0;0;0;0;0;0;0;0;0;0
GB166;Is there productive morphological paucal marking on nouns?;noun;number;word;0;0;0;1;0;0;0;0;0;0;0;0;0;0;0;0;0;0;0;0;0;0;0;0;0;0;0;0;0;0;0;0;0;0;0;0;0;0;0;0;0;0;0;0;0;0;0;0;0;0;0;0;0;0;0;0;0;0;0;0
GB167;Is there a logophoric pronoun?;pronoun;deixis;clause;0;0;0;1;?;0;0;0;0;0;0;0;0;0;0;0;0;?;0;0;0;0;0;0;0;0;0;0;0;0;0;0;0;0;?;0;1;0;0;0;0;0;0;0;0;0;0;0;?;0;0;0;0;0;0;0;0;0;0;0
GB170;Can an adnominal property word agree with the noun in gender/noun class?;adjective;class agreement;NP;0;0;0;0;0;0;0;0;0;0;0;0;0;0;0;0;0;0;0;0;0;0;0;0;0;0;0;0;0;0;0;0;0;0;0;0;0;0;0;0;0;0;0;0;0;0;0;0;0;0;0;0;0;0;0;0;0;0;0;0
GB171;Can an adnominal demonstrative agree with the noun in gender/noun class?;demonstrative;class agreement;NP;0;0;0;0;0;0;0;0;0;0;0;0;0;0;0;0;0;0;0;0;0;0;0;0;0;0;0;0;0;0;0;0;0;0;0;0;0;0;0;0;0;0;0;0;0;0;0;0;0;0;0;0;0;0;0;0;0;0;0;0
GB172;Can an article agree with the noun in gender/noun class?;multiple;class agreement;NP;0;0;0;0;0;0;0;0;0;0;0;0;0;0;0;0;0;0;0;0;0;0;0;0;0;0;0;0;0;0;0;0;0;0;0;0;0;0;0;0;0;0;0;0;0;0;0;0;0;0;0;0;0;0;0;0;0;0;0;0
GB177;Can the verb carry a marker of animacy of argument, unrelated to any gender/noun class of the argument visible in the NP domain?;verb;argument marking (core);word;0;0;0;0;0;0;0;0;0;0;0;0;0;0;0;0;0;0;0;0;0;0;0;0;0;0;0;0;0;0;0;0;0;0;0;0;0;0;?;0;0;0;0;0;0;0;0;0;0;0;0;0;0;0;0;0;0;0;0;0
GB184;Can an adnominal property word agree with the noun in number?;adjective;number;NP;0;0;?;0;0;?;0;0;0;?;0;0;0;0;0;0;?;?;0;0;0;?;0;0;1;0;0;0;1;0;0;0;0;0;0;0;0;?;0;0;0;0;0;0;1;0;0;1;0;0;0;0;0;0;0;1;0;0;0;0
GB185;Can an adnominal demonstrative agree with the noun in number?;demonstrative;number;NP;0;0;0;?;?;?;0;0;?;0;?;1;0;0;0;?;1;?;?;0;0;?;0;1;1;0;?;?;1;0;?;?;1;0;?;1;0;?;?;0;0;?;0;0;1;0;0;1;0;?;0;0;1;0;?;0;1;1;0;?
GB186;Can an article agree with the noun in number?;article;number;NP;0;0;0;0;0;0;0;0;0;0;0;0;0;0;0;0;0;?;0;0;0;0;0;0;0;0;0;0;0;0;0;0;0;0;0;0;0;0;0;0;0;0;0;0;0;0;0;0;0;0;0;0;0;0;0;0;0;0;0;0
